movieId,title,year,genres,first_three_actors,director,original_language,imdb_id,movieIdInt
54505,Manson,1973,Documentary,"Charles Manson, Vincent Bugliosi, Lynette Fromme",Laurence Merrick,en,tt0068918,4345
27850,Halloweentown,1998,"Adventure, Comedy, Family, Fantasy, Horror, TV Movie","Debbie Reynolds, Judith Hoag, Kimberly J. Brown",Duwayne Dunham,en,tt0173886,3449
2186,Within the Woods,1978,Horror,"Bruce Campbell, Ellen Sandweiss, Scott Spiegel",Sam Raimi,en,tt0078503,1358
154622,100 Years at the Movies,1994,Documentary,"Clara Bow, Rin-Tin-Tin, Eugen Sandow",Chuck Workman,en,tt0179624,7040
52458,The Butter Battle Book,1989,"Animation, Family","Charles Durning, Chris Latta, Miriam Flynn",Ralph Bakshi,en,tt0213536,4276
84805,The Fat Albert Halloween Special,1977,Animation,"Bill Cosby, Jan Crawford",Hal Sutherland,en,tt0800332,5220
157723,Nantucket Film Festival's Comedy Roundtable,2012,"Comedy, Documentary, TV Movie","Chris Rock, Ben Stiller, Jim Carrey",Mark Farrell,en,tt2460746,7078
162864,The 3 Rs,2011,Short,Mindy Ramaker,David Lynch,en,tt2061818,7221
137014,How They Get There,1997,"Romance, Comedy","Rico Bueno, Lauren Curry, Mark Gonzales",Spike Jonze,en,tt0351080,6667
27618,The Horribly Slow Murderer with the Extremely Inefficient Weapon,2008,"Comedy, Horror","Paul Clemens, Michael James Kacey, Fay Kato",Richard Gale,en,tt1301160,3402
78278,Special Delivery,2002,Comedy,"Sandrine Kiberlain, Jean-Pierre Darroussin, Dominique Blanc",Jeanne Labrune,fr,tt0302382,4964
45221,"Delphine 1, Yvan 0",1996,Comedy,"Julie Gayet, Alain Chabat, Dominique Farrugia",Dominique Farrugia,en,tt0116069,4032
159704,The Cave of the Golden Rose,1991,"Adventure, Family, Fantasy, Romance","Alessandra Martines, Mario Adorf, Kim Rossi Stuart",Lamberto Bava,it,tt0101095,7160
157787,Nom de code : Rose,2012,"Comedy, Crime","Claire Keim, Lannick Gautry, Serge Hazanavicius",Arnauld Mercadier,fr,tt2492190,7080
131457,Green Light,1937,"Drama, Romance","Errol Flynn, Anita Louise, Margaret Lindsay",Frank Borzage,en,tt0028958,6524
26504,Black Belly of the Tarantula,1971,"Horror, Mystery, Thriller","Giancarlo Giannini, Claudine Auger, Barbara Bouchet",Paolo Cavara,en,tt0069343,3143
92257,Dance Program,1937,Drama,"Harry Baur, Marie Bell, Pierre Blanchar",Julien Duvivier,fr,tt0029706,5471
73922,A Visitor to a Museum,1989,Drama,"Viktor Mikhaylov, Vera Mayorova, Vadim Lobanov",Konstantin Lopushanskiy,ru,tt0173024,4865
123235,Paris-Manhattan,2012,"Comedy, Romance","Alice Taglioni, Patrick Bruel, Marine Delterme",Sophie Lellouche,fr,tt1885331,6289
94904,7 Days in Havana,2012,Drama,"Josh Hutcherson, Daniel Brühl, Emir Kusturica",Laurent Cantet,es,tt1797348,5541
128876,Tower Block,2012,Thriller,"Sheridan Smith, Jack O'Connell, Julie Graham",Ronnie Thompson,en,tt1992258,6467
32088,The Little Drummer Girl,1984,Thriller,"Diane Keaton, Klaus Kinski, Sami Frey",George Roy Hill,en,tt0087629,3598
32649,Sandor slash Ida,2005,"Drama, Romance","Andrej Lunusjkin, André Lidholm, Adam Lundgren",Henrik Georgsson,en,tt0432044,3646
83897,Uprise,2008,Drama,"Isabel Abreu, António Pedroso, Cátia Afonso",Sandro Aguilar,pt,tt1082144,5171
96306,Anotherworld,2008,"Drama, Romance, Foreign","Francesco Apolloni, Domenico Balsamo, Mirko Batoni",Fabiomassimo Lozzi,en,tt1159200,5580
41571,The Heart of the World,2000,"Science Fiction, Drama","Leslie Bais, Caelum Vatnsdal, Shaun Balbar",Guy Maddin,xx,tt0260948,3866
81981,Girl with Hyacinths,1950,"Drama, Mystery","Eva Henning, Ulf Palme, Birgit Tengroth",Hasse Ekman,sv,tt0042466,5106
80337,These Amazing Shadows,2011,Documentary,"Jeff Adachi, James H. Billington, Robin Blaetz",Paul Mariano,en,tt1273222,5041
8779,Journey to the Beginning of Time,1955,"Adventure, Fantasy, Family","Vladimír Bejval, Petr Herrmann, Josef Lukáš",Karel Zeman,cs,tt0047930,2769
163366,Spend It All,1971,Documentary,No Actor,Les Blank,en,tt0067782,7232
137008,small roads,2011,Documentary,No Actor,James Benning,en,tt2317089,6666
49957,Carts of Darkness,2008,Documentary,No Actor,Murray Siple,en,tt1633175,4212
96574,Gerhard Richter Painting,2012,Documentary,Gerhard Richter,Corinna Belz,en,tt1982113,5588
56691,The Wayward Girl,1959,Drama,"Liv Ullmann, Atle Merton, Rolf Søder",Edith Carlmar,no,tt0053437,4409
133643,Karin Daughter of Ingmar,1920,Drama,"Nils Aréhn, Josua Bengtson, Bror Berger",Victor Sjöström,sv,tt0011362,6583
116991,The Monastery of Sendomir,1920,Drama,"Tore Svennberg, Tora Teje, Renée Björling",Victor Sjöström,sv,tt0011370,6164
62851,Under the Flag of the Rising Sun,1972,"Drama, Foreign, History, Mystery","Sanae Nakahara, Tetsurō Tamba, Sachiko Hidari",Kinji Fukasaku,en,tt0289782,4574
26925,The Man They Could Not Hang,1939,"Horror, Science Fiction, Thriller","Boris Karloff, Lorna Gray, Robert Wilcox",Nick Grinde,en,tt0031614,3269
4885,Ten Little Indians,1987,"Crime, Mystery","Vladimir Zeldin, Tatyana Drubich, Aleksandr Kaydanovskiy",Stanislav Govorukhin,ru,tt0092879,2068
166886,"Mother, I Love You",2013,Drama,"Kristofers Konovalovs, Vita Vārpiņa, Matīss Livcāns",Jānis Nords,lv,tt2434988,7291
1871,Fantomas,1964,"Comedy, Crime, Adventure, Fantasy","Jean Marais, Louis de Funès, Mylène Demongeot",André Hunebelle,fr,tt0058089,1128
1870,Fantomas Unleashed,1965,"Comedy, Crime, Adventure, Fantasy","Jean Marais, Louis de Funès, Mylène Demongeot",André Hunebelle,fr,tt0059168,1127
1875,Fantomas vs. Scotland Yard,1967,"Comedy, Crime, Adventure, Fantasy","Jean Marais, Louis de Funès, Mylène Demongeot",André Hunebelle,fr,tt0060400,1132
92,Megacities,1998,Documentary,Shankar Loutakke,Michael Glawogger,en,tt0169024,55
100246,Gertie the Dinosaur,1914,"Animation, Comedy","Winsor McCay, George McManus, Roy L. McCardell",Winsor McCay,en,tt0004008,5704
3485,The Castle of Fu Manchu,1969,"Crime, Adventure, Horror, Thriller","Christopher Lee, Richard Greene, Howard Marion-Crawford",Jesús Franco,en,tt0064338,1745
49183,The Vengeance of Fu Manchu,1967,"Crime, Horror, Mystery","Christopher Lee, Douglas Wilmer, Horst Frank",Jeremy Summers,en,tt0063764,4186
136742,Gulf Stream Under the Iceberg,2012,"Drama, Fantasy","Aleksey Serebryakov, Kseniya Rappoport, Danila Kozlovsky",Yevgeni Pashkevich,en,tt2192200,6655
98560,The Diary of Preston Plummer,2012,"Drama, Romance","Trevor Morgan, Rumer Willis, Robert Loggia",Sean Ackerman,en,tt1319709,5660
84442,Oxygen,2009,Thriller,"Aleksey Filimonov, Karolina Gruszka, Varvara Voetskova",Ivan Vyrypaev,ru,tt1441309,5203
95010,The Kiss of Her Flesh,1968,"Thriller, Horror","Uta Erickson, Janet Banzet, Michael Findlay",Michael Findlay,en,tt0125316,5546
47868,The First Men in the Moon,2010,Science Fiction,"Rory Kinnear, Mark Gatiss, Alex Riddell",Damon Thomas,en,tt1535107,4131
3168,Three-Step Dance,2003,Drama,"Yaël Abecassis, Michele Carboni, Caroline Ducey",Salvatore Mereu,en,tt0389778,1715
128508,Pretty Butterflies,2012,Drama,"Micaela Ramazzotti, Sara Podda, Maya Mulas",Salvatore Mereu,en,tt2384642,6450
3480,The Old Gun,1975,"Drama, History","Philippe Noiret, Romy Schneider, Jean Bouise",Robert Enrico,fr,tt0073864,1742
5063,The Passerby,1982,Drama,"Romy Schneider, Michel Piccoli, Helmut Griem",Jacques Rouffio,fr,tt0084479,2153
3423,The Things of Life,1970,Drama,"Michel Piccoli, Romy Schneider, Lea Massari",Claude Sautet,fr,tt0064165,1733
124857,Trojan Eddie,1996,"Drama, Romance, Foreign","Stephen Rea, Richard Harris, Stuart Townsend",Gillies MacKinnon,en,tt0117969,6333
80346,Nobody Knows Anything!,2003,"Comedy, Drama","Alanna Ubach, Michael Lerner, Mike Myers",William Tannen,en,tt0142634,5042
144910,Suppose They Gave a War and Nobody Came?,1970,"Drama, Comedy","Brian Keith, Tony Curtis, Ernest Borgnine",Hy Averback,en,tt0066422,6851
110390,A Pigeon Sat on a Branch Reflecting on Existence,2014,"Drama, Comedy","Holger Andersson, Nisse Vestblom, Viktor Gyllenberg",Roy Andersson,sv,tt1883180,6005
72784,The Loft,2014,Thriller,"Karl Urban, James Marsden, Wentworth Miller",Erik Van Looy,en,tt1850397,4825
88599,Karen Cries on the Bus,2011,Drama,"Angela Carrizosa, Juan Manuel Diaz Oroztegui, Diego Galindo",Gabriel Rojas Vera,es,tt1754003,5374
167810,Lost River,2015,"Fantasy, Thriller","Christina Hendricks, Saoirse Ronan, Eva Mendes",Ryan Gosling,en,tt2366608,7311
125305,Landscape Suicide,1987,"Crime, Drama","Rhonda Bell, Elion Sucher",James Benning,en,tt0206871,6347
97046,Deseret,1995,Documentary,No Actor,James Benning,en,tt0131356,5611
27873,Battletruck,1982,Science Fiction,"Michael Beck, Annie McEnroe, James Wainwright",Harley Cokeliss,en,tt0084887,3456
93939,The Shuttered Room,1967,"Drama, Mystery, Horror","Gig Young, Carol Lynley, Oliver Reed",David Greene,en,tt0062266,5519
169800,The Retrieval,2013,"Western, Drama, History","Ashton Sanders, Tishuan Scott, Keston John",Chris Eska,en,tt2635006,7361
89720,Kiss of the Tarantula,1976,Horror,"Suzanna Ling, Herman Wallner, Linda Spatz",Chris Munger,en,tt0131449,5399
110123,Incredible Rocky Mountain Race,1977,"Adventure, Comedy, Drama","Christopher Connelly, Forrest Tucker",James L. Conway,en,tt0076192,6000
110555,Street Days,2010,"Foreign, Drama","Zura Begalishvili, Gaga Chikhladze, Eka Chkheidze",Levan Koguashvili,ru,tt1543701,6017
56511,Fantômas: Juve Against Fantômas,1913,"Crime, Drama","René Navarre, Georges Melchior, Edmund Breon",Louis Feuillade,fr,tt0003037,4402
56515,Fantômas: The False Magistrate,1914,"Crime, Drama","René Navarre, Georges Melchior, Edmund Breon",Louis Feuillade,fr,tt0003952,4403
44191,Loose Screws,1985,Comedy,"Bryan Genesse, Lance Van Der Kolk, Alan Deveau",Rafal Zielinski,en,tt0089501,3996
93116,Valet Girls,1987,Comedy,"Mary Kohnert, Jack DeLeon, Jon Sharp",Rafal Zielinski,en,tt0094237,5499
107625,The Proud Ones,1956,"Action, Western","Robert Ryan, Virginia Mayo, Jeffrey Hunter",Robert D. Webb,en,tt0049639,5924
143747,"$1,000 on the Black",1966,Western,"Anthony Steffen, Gianni Garko, Erika Blanc",Alberto Cardone,it,tt0060697,6818
64650,Sartana the Gravedigger,1969,"Western, Mystery","Klaus Kinski, Gianni Garko, Frank Wolff",Giuliano Carnimeo,it,tt0065019,4611
115353,One Damned Day at Dawn... Django Meets Sartana!,1970,Western,"Jack Betts, Fabio Testi, Dino Strano",Demofilo Fidani,it,tt0067643,6127
83140,"I Am Sartana, Trade Your Guns for a Coffin",1970,"Drama, Western","George Hilton, Charles Southwood, Erika Blanc",Giuliano Carnimeo,it,tt0065509,5143
27866,Kevin Hart: I'm a Grown Little Man,2009,Comedy,Kevin Hart,Shannon Hartman,en,tt1420554,3455
5519,Finders Killers,1971,Western,"Gordon Mitchell, Dino Strano, Pia Giancaro",Gianni Crea,it,tt0066346,2245
150704,Four Gunmen of the Holy Trinity,1971,Western,"Peter Lee Lawrence, Ida Galli, Phillipe Hersent",Giorgio Cristallini,it,tt0196886,6974
86637,Ricco,1973,"Action, Foreign","Christopher Mitchum, Barbara Bouchet, Malisa Longo",Tulio Demicheli,it,tt0068183,5299
83132,St. Louis Blues,1958,"Drama, Music","Nat 'King' Cole, Eartha Kitt, Cab Calloway",Allen Reisner,en,tt0052234,5142
102533,Stormy Weather,2003,Drama,"Élodie Bouchez, Didda Jónsdóttir, Baltasar Kormákur",Sólveig Anspach,en,tt0348876,5750
110227,The Borrowers,1973,"Family, Fantasy","Eddie Albert, Judith Anderson, Tammy Grimes",Walter C. Miller,en,tt0069817,6002
140383,Keep an Eye on Amelia,1949,Comedy,"Danielle Darrieux, Jean Desailly, Victor Guyau",Claude Autant-Lara,fr,tt0041710,6739
110553,Austin High,2011,Comedy,"Michael S. Wilson, Bill Wise, Melinda Y. Cohen",Alan Deutsch,en,tt1683524,6016
138394,Monty Python - Almost the Truth (The Lawyer's Cut),2009,"Documentary, Biography","John Cleese, Graham Chapman, Michael Palin",Bill Jones,en,tt1422182,6697
69569,Mark Strikes Again,1976,Action,"Franco Gasparri, John Saxon, John Steiner",Stelvio Massi,it,tt0151495,4705
90019,Magnum Cop,1978,Thriller,"Maurizio Merli, Joan Collins, Franco Ressel",Stelvio Massi,en,tt0076554,5411
6591,What Have You Done to Solange?,1972,"Mystery, Thriller","Fabio Testi, Karin Baal, Joachim Fuchsberger",Massimo Dallamano,it,tt0068416,2471
136576,Counselor at Crime,1973,Crime,"Martin Balsam, Tomás Milián, Francisco Rabal",Alberto De Martino,it,tt0069916,6651
8014,Valley of Flowers,2006,"Adventure, Drama, Romance","Mylène Jampanoï, Milind Soman, Naseeruddin Shah",Pan Nalin,en,tt0392883,2627
81684,The Gruffalo's Child,2011,"Adventure, Animation, Family, Fantasy","Helena Bonham Carter, Rob Brydon, Tom Wilkinson",Uwe Heidschötter,en,tt2132486,5095
37727,Jönssonligan får guldfeber,1984,Comedy,"Gösta Ekman, Ulf Brunnberg, Björn Gustafson",Mikael Ekman,sv,tt0087527,3786
37731,Jönssonligans största kupp,1995,"Comedy, Crime","Ulf Brunnberg, Björn Gustafson, Stellan Skarsgård",Hans Åke Gabrielsson,sv,tt0113510,3787
171427,Studentfesten,2013,Comedy,"Anastasios Soulis, Henrik Lundström, Filip Berg",Simon Sandquist,sv,tt2642442,7393
8743,At Point Blank,2003,"Action, Thriller, Crime","Sofia Helin, Mikael Persbrandt, Stefan Sauk",Peter Lindmark,sv,tt0353962,2755
86835,Knight of Cups,2015,"Romance, Drama","Christian Bale, Cate Blanchett, Natalie Portman",Terrence Malick,en,tt2101383,5312
8906,Cloud 9,2008,"Drama, Romance","Ursula Werner, Horst Rehberg, Horst Westphal",Andreas Dresen,de,tt1037228,2832
107357,The Man Who Wouldn't Die,1994,"Crime, Drama, Thriller","Roger Moore, Malcolm McDowell, Nancy Allen",Bill Condon,en,tt0113752,5914
175503,From Morn to Midnight,1920,"Drama, Horror, Thriller","Ernst Deutsch, Erna Morena, Hans Heinrich von Twardowski",Karlheinz Martin,de,tt0011833,7493
107028,Green Ice,1981,"Adventure, Romance","Ryan O'Neal, Anne Archer, Omar Sharif",Ernest Day,en,tt0082476,5904
120122,Vesna Goes Fast,1996,Drama,"Tereza Zajickova, Antonio Albanese, Silvio Orlando",Carlo Mazzacurati,it,tt0118074,6224
2141,James Dean,2001,Drama,"James Franco, Michael Moriarty, Valentina Cervi",Mark Rydell,en,tt0240628,1330
37058,I'm Here,2010,Drama,"Sienna Guillory, Andrew Garfield",Spike Jonze,en,tt1571404,3774
5602,The Common Man,1975,"Drama, Thriller","Jean Carmet, Pascale Roberts, Ginette Garcin",Yves Boisset,fr,tt0071449,2263
152635,The Assassination,1972,"Thriller, History","Jean-Louis Trintignant, Michel Piccoli, Jean Seberg",Yves Boisset,fr,tt0068233,6999
91571,And Hope to Die,1972,"Crime, Drama","Jean-Louis Trintignant, Robert Ryan, Lea Massari",René Clément,fr,tt0068420,5447
3004,Twelve Plus One,1969,Comedy,"Sharon Tate, Vittorio Gassman, Orson Welles",Nicolas Gessner,en,tt0065361,1618
142979,The Joy of Living,1961,Comedy,"Alain Delon, Barbara Lass, Gino Cervi",René Clément,it,tt0053707,6805
127092,Nick the Sting,1976,Crime,"Luc Merenda, Lee J. Cobb, Gabriele Ferzetti",Fernando Di Leo,en,tt0074137,6412
100032,The Great Los Angeles Earthquake,1990,"Drama, Action","Joanna Kerns, Dan Lauria, Bonnie Bartlett",Larry Elikann,en,tt0099137,5694
31547,Şaban Oğlu Şaban,1977,Comedy,"Kemal Sunal, Halit Akçatepe, Şener Şen",Ertem Eğilmez,tr,tt0253614,3541
105554,The Forgotten Space,2010,Documentary,No Actor,Noël Burch,en,tt1772382,5853
7392,"Ilsa, Harem Keeper of the Oil Sheiks",1976,"Action, Horror","Dyanne Thorne, Max Thayer, Jerry Delony",Don Edmonds,en,tt0074670,2589
158382,Hotel Hell Vacation,2010,Comedy,"Chevy Chase, Beverly D'Angelo, Travis Greer",Bryan Buckley,en,tt1600409,7103
98554,Serving Life,2011,"TV Movie, Documentary",Forest Whitaker,Lisa R. Cohen,en,tt1699762,5659
104644,A Reflection of Fear,1973,Horror,"Robert Shaw, Sally Kellerman, Sondra Locke",William A. Fraker,en,tt0070599,5820
86508,Love Camp,1977,"Adventure, Drama, Thriller","Muriel Montossé, Ada Tauler, Monica Swinn",Jesús Franco,de,tt0074548,5294
175287,Lost and Found,1979,Comedy,"George Segal, Glenda Jackson, Maureen Stapleton",Melvin Frank,en,tt0079486,7489
95744,La montaña rusa,2012,"Comedy, Romance","Verónica Sánchez, Ernesto Alterio, Alberto San Juan",Emilio Martínez Lázaro,en,tt1847629,5561
117913,The Testimony,1946,"Crime, Drama","Roldano Lupi, Marina Berti, Ernesto Almirante",Pietro Germi,it,tt0038155,6188
69974,The Sea That Thinks,2000,"Adventure, Biography, Comedy","Bart Klever, Devika Strooker, Rick de Leeuw",Gert de Graaff,en,tt0261277,4714
54796,Thicker than Water,2005,"TV Movie, Drama","Melissa Gilbert, Lindsay Wagner",David S. Cass Sr.,en,tt0433649,4352
173635,The Argyle Secrets,1948,"Drama, Mystery, Romance","William Gargan, Marjorie Lord, Ralph Byrd",Cy Endfield,en,tt0040112,7461
126331,The Invisible Ones,2012,"Romance, Documentary",Thérèse Clerc,Sébastien Lifshitz,fr,tt2399533,6390
92309,The Monkey Hustle,1976,Action,"Yaphet Kotto, Rudy Ray Moore, Kirk Calloway",Arthur Marks,en,tt0076404,5474
4274,Fort Saganne,1984,"War, Drama, History","Gérard Depardieu, Philippe Noiret, Catherine Deneuve",Alain Corneau,fr,tt0087284,1898
129311,A Gun For Jennifer,1997,"Drama, Thriller, Crime","Deborah Twiss, Benja Kay, Rene Alberta",Todd Morris,en,tt0160339,6475
2993,One on Top of the Other,1969,"Mystery, Thriller","Marisa Mell, Jean Sorel, Elsa Martinelli",Lucio Fulci,it,tt0065148,1613
125141,Hell Behind the Bars,1984,"Action, Drama","Rita Silva, Ajita Wilson, Linda Jones",Gianni Siragusa,it,tt0438321,6340
121493,A Summer in La Goulette,1996,"Drama, Comedy","Sonia Mankaï, Claudia Cardinale, Gamil Ratib",Férid Boughedir,fr,tt0114775,6251
6547,Schtonk!,1992,"History, Comedy","Götz George, Uwe Ochsenknecht, Christiane Hörbiger",Helmut Dietl,de,tt0105328,2466
25745,The Gamers,2002,"Action, Comedy, Thriller, Foreign","Matt Cameron, Chris Duppenthaler, Justin MacGregor",Matt Vancil,en,tt0369445,2909
27706,The Night Child,1975,Horror,"Richard Johnson, Joanna Cassidy, Ida Galli",Massimo Dallamano,en,tt0073367,3417
118390,Venus in Furs,1969,Drama,"Laura Antonelli, Régis Vallée, Loren Ewing",Massimo Dallamano,it,tt0064626,6194
90015,Bandidos,1967,"Drama, Action, Western","Terry Jenkins, Enrico Maria Salerno, Cris Huerta",Massimo Dallamano,it,tt0062706,5410
119569,Marvel One-Shot: Item 47,2012,"Science Fiction, Action, Fantasy","Lizzy Caplan, Jesse Bradford, Maximiliano Hernández",Louis D'Esposito,en,tt2247732,6214
89351,Daddy's Deadly Darling,1972,Horror,"Jesse Vint, Walter Barnes, Marc Lawrence",Marc Lawrence,en,tt0070537,5388
96631,Piggy,2012,Thriller,"Paul Anderson, Martin Compston, Ed Skrein",Kieron Hawkes,en,tt1951218,5590
159652,Hank and Asha,2014,"Comedy, Romance","Mahira Kakkar, Andrew Pastides, Brian Sloan",James E. Duff,en,tt2330270,7159
66584,Le party,1990,Drama,"Charlotte Laurier, Benoît Dagenais, Julien Poulin",Pierre Falardeau,fr,tt0100334,4647
146380,The Legend of Bloody Jack,2007,Horror,"Craig Bonacorsi, Erica Curtis, Jonathan Kowalsky",Todd Portugal,en,tt0961206,6876
160874,The Third Reich: The Rise & Fall,2010,Documentary,No Actor,Nicole Rittenmeyer,en,tt1855924,7182
110779,Urban Warriors,1987,"Science Fiction, Action","Bruno Bilotta, Alex Vitale, Bjorn Hammer",Giuseppe Vari,it,tt0289596,6026
128588,Covert Action,1978,Thriller,"David Janssen, Arthur Kennedy, Maurizio Merli",Romolo Guerrieri,it,tt0077376,6452
45179,Xuxa in Crystal Moon,1990,"Comedy, Family, Romance","Xuxa Meneghel, Sérgio Mallandro, Marilu Bueno",Tizuka Yamasaki,pt,tt0100070,4028
83912,New Scenes from America,2002,Documentary,"Henree Alyse, John Ashbery, John Cale",Jørgen Leth,en,tt0347623,5172
106326,The Adventurers,1970,"Drama, Action, Adventure","Charles Aznavour, Alan Badel, Candice Bergen",Lewis Gilbert,en,tt0065374,5884
78124,Impy's Wonderland,2008,"Animation, Adventure, Family, Fantasy","Anke Engelke, Christoph Maria Herbst, Oliver Kalkofe",Reinhard Klooss,de,tt1210117,4956
2963,The Impossible Voyage,1904,"Adventure, Comedy, Fantasy, Science Fiction","Georges Méliès, Fernande Albeny, Jeanne d'Alcy",Georges Méliès,fr,tt0000499,1596
33229,Dickson Greeting,1891,Documentary,William K.L. Dickson ,William K.L. Dickson ,xx,tt0241373,3679
157152,Moving Alan,2003,Comedy,"Misha Collins, Marley Shelton, Samantha Shelton",Christopher Shelton,en,tt0310741,7067
91908,Rings,2005,"Horror, Thriller","Ryan Merriman, Emily VanCamp, Kelly Stables",Jonathan Liebesman,en,tt0449092,5462
84176,Bestiary,2012,Documentary,No Actor,Denis Côté,fr,tt2125439,5183
102807,Carcasses,2009,Documentary,No Actor,Denis Côté,en,tt1426357,5753
106922,The incredible Paris Incident,1967,"Action, Adventure, Comedy, Science Fiction","Roger Browne, Dominique Boschero, Eduardo Fajardo",Sergio Grieco,it,tt0061500,5902
53769,Singapore,1947,"Adventure, Crime, Romance","Fred MacMurray, Ava Gardner, Roland Culver",John Brahm,en,tt0039829,4310
144204,Thanatomorphose,2012,Horror,"Émile Beaudry, Eryka Cantieri, Roch-Denis Gagnon",Éric Falardeau,en,tt2385074,6825
112454,Clown,2014,Horror,"Peter Stormare, Laura Allen, Elizabeth Whitmere",Jon Watts,en,tt1780798,6058
85025,Memory Lane,2010,Drama,"Thibault Vinçon, Dounia Sichov, Lolita Chammah",Mikhaël Hers,en,tt1568863,5231
43871,Beloved Enemy,1936,"Drama, Romance","Merle Oberon, Brian Aherne, Jerome Cowan",H. C. Potter,en,tt0027345,3975
5065,Carry On Cowboy,1966,"Comedy, Western","Sid James, Jim Dale, Angela Douglas",Gerald Thomas,en,tt0059014,2155
171045,Dead End,2012,"Horror, Thriller","Jamie Foreman, Wil Johnson, Jon Campling",Nicholas David Lean,en,tt2393817,7385
124521,Dead on Course,1952,"Crime, Drama, Thriller","Zachary Scott, Robert Beatty, Naomi Chance",Terence Fisher,en,tt0045331,6318
32941,The House Across the Lake,1954,"Drama, Thriller","Alex Nicol, Hillary Brooke, Sid James",Ken Hughes,en,tt0047067,3664
40681,Jailbait!,2000,"Comedy, Drama","Alycia Purrott, Reagan Pasternak, Kevin Mundy",Allan Moyle,en,tt0226009,3839
163631,Oliver's Story,1978,Drama,"Ryan O'Neal, Candice Bergen, Nicola Pagett",John Korty,en,tt0078024,7238
109102,Picture Mommy Dead,1966,Horror,"Don Ameche, Martha Hyer, Susan Gordon",Bert I. Gordon,en,tt0060831,5967
169158,Standoff,1998,Crime,"Robert Sean Leonard, Dennis Haysbert, Natasha Henstridge",Andrew Chapman,en,tt0119931,7344
158113,The Case of the Stuttering Bishop,1937,"Mystery, Crime, Drama","Donald Woods, Ann Dvorak, Anne Nagel",William Clemens,en,tt0028695,7098
148410,The Case of the Velvet Claws,1936,"Mystery, Comedy, Crime","Warren William, Claire Dodd, Wini Shaw",William Clemens,en,tt0027429,6913
141978,They Rode West,1954,"Western, Action","Robert Francis, Donna Reed, May Wynn",Phil Karlson,en,tt0047575,6779
154140,Men in White,1998,"Science Fiction, Comedy","Thomas F. Wilson, Karim Prince, M. Emmet Walsh",Scott P. Levy,en,tt0156789,7031
97899,Magnificent Presence,2012,Drama,"Elio Germano, Margherita Buy, Vittoria Puccini",Ferzan Ozpetek,it,tt2281345,5627
101904,Through the Forest,2005,"Fantasy, Drama","Camille Berthomier, Aurélien Wiik, Morgane Hainaux",Jean-Paul Civeyrac,fr,tt0477404,5734
31347,Cardcaptor Sakura: The Sealed Card,2000,"Comedy, Animation, Adventure, Fantasy, Romance","Sakura Tange, Kumai Motoko, Aya Hisakawa",Morio Asaka,ja,tt0301083,3524
71591,The Linguists,2008,Documentary,No Actor,Seth Kramer,en,tt1172995,4776
90086,Devil's Angels,1967,Action,"John Cassavetes, Beverly Adams, Mimsy Farmer",Daniel Haller,en,tt0061565,5414
100205,Baby Snakes,1979,"Documentary, Comedy, Music",Frank Zappa,Frank Zappa,en,tt0078820,5703
27036,Too Late for Tears,1949,"Crime, Mystery","Lizabeth Scott, Don DeFore, Dan Duryea",Byron Haskin,en,tt0041968,3299
71910,Sitting Target,1972,"Crime, Action","Oliver Reed, Jill St. John, Ian McShane",Douglas Hickox,en,tt0069273,4789
142408,Laissons Lucie faire !,2000,"Romance, Comedy","Marie Gillain, Emmanuel Mouret, Dolores Chaplin",Emmanuel Mouret,fr,tt0235532,6794
144288,Berserk: The Golden Age Arc 3 - The Advent,2013,"Animation, Action, Fantasy","Hiroaki Iwanaga, Toa Yukinari, Takahiro Sakurai",Toshiyuki Kubooka,ja,tt2358913,6827
125990,The Hunt for the Unicorn Killer,1999,"Drama, Thriller","Kevin Anderson, Tom Skerritt, Naomi Watts",William A. Graham,en,tt0189593,6373
97593,Shark Kill,1976,"TV Movie, Adventure","Richard Yniguez, Phillip Clark, Jennifer Warren",William A. Graham,en,tt0075205,5618
38198,Itinerary of a Spoiled Child,1988,"Drama, Adventure","Jean-Paul Belmondo, Richard Anconina, Marie-Sophie L.",Claude Lelouch,fr,tt0095386,3795
136070,Vengeance Can Wait,2010,"Romance, Comedy, Drama","Tadanobu Asano, Minami, Eiko Koike",Masanori Tominaga,ja,tt1569488,6641
140441,Sadako 3D,2012,Horror,"Ai Hashimoto, Satomi Ishihara, Kôji Seto",Tsutomu Hanabusa,ja,tt1844025,6742
26340,Delta Force 3: The Killing Game,1991,"Action, Adventure","Nick Cassavetes, Eric Douglas, Mike Norris",Sam Firstenberg,en,tt0101702,3098
26113,Operation Thunderbolt,1977,"Action, Drama, Thriller","Yehoram Gaon, Gila Almagor, Klaus Kinski",Menahem Golan,he,tt0076398,3009
90806,Hot T-Shirts,1980,Comedy,"Ray Holland, Glenn Mure, Stephanie Lawlor",Chuck Vincent,en,tt0079309,5424
63590,Hospital Massacre,1981,"Horror, Thriller","Barbi Benton, Charles Lucia, Jon Van Ness",Boaz Davidson,en,tt0082527,4590
5896,Bolero,1984,"Drama, Romance","Bo Derek, George Kennedy, Ana Obregón",John Derek,en,tt0086987,2340
71750,Sleeping Beauty,1987,"Family, Fantasy","Tahnee Welch, Kenny Baker, Morgan Fairchild",David Irving,en,tt0093993,4786
117428,Wild 90,1968,"Drama, Crime","Norman Mailer, Buzz Farber, Mickey Knox",Norman Mailer,en,tt0062492,6171
117424,Maidstone,1970,Drama,"Norman Mailer, Rip Torn",Norman Mailer,en,tt0064625,6169
79570,Beat the Drum,2003,Drama,"Junior Singo, Mary Twala, Adelaide Shabalala",David Hickson,en,tt0387057,5002
169656,Gorilla Bathes at Noon,1993,Comedy,"Svetozar Cvetković, Anita Mančić, Alexandra Rohmig",Dusan Makavejev,sr,tt0107037,7352
83361,McCinsey's Island,1998,"Action, Adventure, Comedy","Hulk Hogan, Grace Jones, Robert Vaughn",Sam Firstenberg,en,tt0119639,5151
136190,In the Shadow,2012,"Crime, Drama","Ivan Trojan, Sebastian Koch, Soňa Norisová",David Ondříček,cs,tt1860359,6643
106682,The Comeback,1978,"Horror, Mystery, Thriller","Jack Jones, Pamela Stephenson, David Doyle",Pete Walker,en,tt0077357,5895
8371,Guter Junge,2008,Drama,"Klaus J. Behrendt, Sebastian Urzendowsky, Gabriela Maria Schmeide",Torsten C. Fischer,de,tt1205492,2680
165027,Light Gradient,2009,"Drama, Mystery, Romance","Sebastian Schlecht, Eric Golub, Iris Minich",Jan Krüger,de,tt1351770,7259
