movieId,title,year,genres,first_three_actors,director,original_language,imdb_id,movieIdInt
616,The Last Samurai,2003,"Drama, Action, War, History","Tom Cruise, Ken Watanabe, William Atherton",Edward Zwick,en,tt0325710,469
587,Big Fish,2003,"Adventure, Fantasy, Drama","Ewan McGregor, Albert Finney, Billy Crudup",Tim Burton,en,tt0319061,443
6964,Something's Gotta Give,2003,"Drama, Comedy, Romance","Jack Nicholson, Diane Keaton, Keanu Reeves",Nancy Meyers,en,tt0337741,2514
1792,Stuck on You,2003,Comedy,"Matt Damon, Greg Kinnear, Eva Mendes",Bobby Farrelly,en,tt0338466,1087
3635,Girl with a Pearl Earring,2003,"Drama, Romance","Scarlett Johansson, Colin Firth, Cillian Murphy",Peter Webber,en,tt0335119,1795
122,The Lord of the Rings: The Return of the King,2003,"Adventure, Fantasy, Action","Elijah Wood, Ian McKellen, Viggo Mortensen",Peter Jackson,en,tt0167260,83
8696,Calendar Girls,2003,Comedy,"Helen Mirren, Julie Walters, John Alderton",Nigel Cole,en,tt0337909,2745
47952,Two Men Went To War,2002,"Comedy, Drama, Foreign, War","Kenneth Cranham, Rosanna Lavelle, Phyllida Law",John Henderson,en,tt0304857,4140
504,Monster,2003,"Crime, Drama","Charlize Theron, Christina Ricci, Bruce Dern",Patty Jenkins,en,tt0340855,378
2289,Cold Mountain,2003,Drama,"Jude Law, Nicole Kidman, Renée Zellweger",Anthony Minghella,en,tt0159365,1402
42418,Young Black Stallion,2003,"Adventure, Drama, Family","Biana Tamimi, Richard Romanus, Patrick Elias",Simon Wincer,en,tt0318850,3901
26710,My Baby's Daddy,2004,Comedy,"Eddie Griffin, Anthony Anderson, Michael Imperioli",Cheryl Dunye,en,tt0332712,3211
31026,Distant,2002,Drama,"Muzaffer Özdemir, Emin Toprak, Zuhal Gencer",Nuri Bilge Ceylan,tr,tt0346094,3490
5966,Along Came Polly,2004,"Comedy, Romance","Ben Stiller, Jennifer Aniston, Philip Seymour Hoffman",John Hamburg,en,tt0343135,2365
52867,Lord Love a Duck,1966,"Comedy, Drama","Roddy McDowall, Tuesday Weld, Lola Albright",George Axelrod,en,tt0060636,4287
1937,Bonjour Tristesse,1958,Drama,"Jean Seberg, Deborah Kerr, David Niven",Otto Preminger,en,tt0051429,1180
26712,The Enforcer,1951,"Drama, Action, Crime","Humphrey Bogart, Zero Mostel, Ted de Corsia",Raoul Walsh,en,tt0043503,3212
1882,The Men,1950,Drama,"Marlon Brando, Teresa Wright, Everett Sloane",Fred Zinnemann,en,tt0042727,1137
118910,The Court-Martial of Billy Mitchell,1955,"Drama, War","Gary Cooper, Charles Bickford, Ralph Bellamy",Otto Preminger,en,tt0047956,6208
6277,Crime Spree,2003,"Action, Comedy","Gérard Depardieu, Harvey Keitel, Johnny Hallyday",Brad Mirman,en,tt0310924,2414
427,Mon oncle,1958,Comedy,"Jacques Tati, Jean-Pierre Zola, Adrienne Servantie",Jacques Tati,fr,tt0050706,323
3022,Dr. Jekyll and Mr. Hyde,1941,"Drama, Horror, Science Fiction","Spencer Tracy, Ingrid Bergman, Lana Turner",Victor Fleming,en,tt0033553,1629
778,Monsieur  Hulot's Holiday,1953,"Comedy, Family","Jacques Tati, Nathalie Pascaud, Micheline Rolla",Jacques Tati,fr,tt0046487,591
3088,My Darling Clementine,1946,"Drama, Western","Henry Fonda, Linda Darnell, Victor Mature",John Ford,en,tt0038762,1678
980,The Ox-Bow Incident,1943,"Action, Drama, Western","Henry Fonda, Dana Andrews, Mary Beth Hughes",William A. Wellman,en,tt0036244,764
42094,Micki & Maude,1984,"Romance, Comedy","Dudley Moore, Amy Irving, Ann Reinking",Blake Edwards,en,tt0087718,3889
5205,Pumping Iron,1977,Documentary,"Arnold Schwarzenegger, Franco Columbu, Lou Ferrigno",George Butler,en,tt0076578,2192
2017,No Good Deed,2002,"Action, Crime, Drama, Mystery, Thriller","Samuel L. Jackson, Milla Jovovich, Stellan Skarsgård",Bob Rafelson,en,tt0292610,1247
71189,"Where Angels Go, Trouble Follows",1968,Comedy,"Rosalind Russell, Stella Stevens, Binnie Barnes",James Neilson,en,tt0063800,4758
73515,Mesmerized,1985,Drama,"John Lithgow, Jodie Foster, Michael Murphy",Michael Laughlin,en,tt0091513,4855
405,La Strada,1954,Drama,"Anthony Quinn, Giulietta Masina, Richard Basehart",Federico Fellini,it,tt0047528,308
4917,A Boy and His Dog,1975,"Drama, Science Fiction, Comedy","Don Johnson, Susanne Benton, Jason Robards",L.Q. Jones,en,tt0072730,2080
5055,Ashes and Diamonds,1958,"War, Drama","Zbigniew Cybulski, Ewa Krzyżewska, Waclaw Zastrzezynski",Andrzej Wajda,pl,tt0052080,2148
3059,Intolerance: Love's Struggle Throughout the Ages,1916,Drama,"Lillian Gish, Mae Marsh, Robert Harron",D.W. Griffith,en,tt0006864,1655
27329,The Legend of Suriyothai,2001,"Drama, Foreign, History, War","M.L. Piyapas Bhirombhakdi, Sarunyu Wongkrachang, Chatchai Plengpanich",Chatrichalerm Yukol,th,tt0290879,3349
114046,The Three Stooges in Orbit,1962,"Comedy, Science Fiction","Moe Howard, Larry Fine, Joe DeRita",Edward Bernds,en,tt0056580,6096
82283,It,1927,"Drama, Comedy, Romance","Clara Bow, Antonio Moreno, William Austin",Josef von Sternberg,en,tt0018033,5113
1954,The Butterfly Effect,2004,"Science Fiction, Thriller","Ashton Kutcher, Melora Walters, Amy Smart",Eric Bress,en,tt0289879,1194
1278,The Dreamers,2003,"Drama, Romance","Michael Pitt, Eva Green, Louis Garrel",Bernardo Bertolucci,en,tt0309987,838
7008,The Wilby Conspiracy,1975,"Action, Adventure, Drama, Thriller","Sidney Poitier, Michael Caine, Nicol Williamson",Ralph Nelson,en,tt0073901,2528
1824,50 First Dates,2004,"Comedy, Romance","Adam Sandler, Drew Barrymore, Rob Schneider",Peter Segal,en,tt0343660,1098
44674,After Life,2002,"Crime, Drama","Dominique Blanc, Gilbert Melki, Ornella Muti",Lucas Belvaux,fr,tt0233230,4010
337,Monsieur Ibrahim,2003,Drama,"Omar Sharif, Pierre Boulanger, Gilbert Melki",François Dupeyron,fr,tt0329388,271
43376,Diary of a Country Priest,1951,Drama,"Claude Laydu, Jean Riveyre, Adrien Borel",Robert Bresson,fr,tt0042619,3946
2576,The Diary of Anne Frank,1959,"Drama, History","Millie Perkins, Joseph Schildkraut, Shelley Winters",George Stevens,en,tt0052738,1480
2099,Raw Deal,1986,"Action, Crime, Thriller","Arnold Schwarzenegger, Kathryn Harrold, Darren McGavin",John Irvin,en,tt0091828,1302
6470,Fire Birds,1990,"Action, Adventure","Nicolas Cage, Tommy Lee Jones, Sean Young",David Green,en,tt0099575,2444
8842,Against the Ropes,2004,"Romance, Drama","Meg Ryan, Tony Shalhoub, Joe Cortese",Charles S. Dutton,en,tt0312329,2787
615,The Passion of the Christ,2004,Drama,"Jim Caviezel, Maia Morgenstern, Monica Bellucci",Mel Gibson,en,tt0335345,468
338,"Good bye, Lenin!",2003,"Comedy, Drama, Romance","Daniel Brühl, Katrin Sass, Chulpan Khamatova",Wolfgang Becker,de,tt0301357,272
2023,Hidalgo,2004,"Western, Adventure","Viggo Mortensen, Zuleikha Robinson, Omar Sharif",Joe Johnston,en,tt0317648,1253
25935,The Reckoning,2003,"Crime, Drama, Mystery","Paul Bettany, Willem Dafoe, Tom Hardy",Paul McGuigan,en,tt0258816,2978
797,Persona,1966,Drama,"Bibi Andersson, Liv Ullmann, Margaretha Krook",Ingmar Bergman,sv,tt0060827,609
42602,The Passion of Anna,1969,Drama,"Max von Sydow, Liv Ullmann, Bibi Andersson",Ingmar Bergman,sv,tt0064793,3907
1723,The Front,1976,"Comedy, Drama","Woody Allen, Michael Murphy, Herschel Bernardi",Martin Ritt,en,tt0074554,1059
1586,Secret Window,2004,"Thriller, Mystery","Johnny Depp, John Turturro, Maria Bello",David Koepp,en,tt0363988,962
156,Wilbur Wants to Kill Himself,2002,"Comedy, Drama, Romance","Jamie Sives, Adrian Rawlins, Shirley Henderson",Lone Scherfig,da,tt0329767,112
2778,Clifford,1994,"Comedy, Family","Martin Short, Charles Grodin, Mary Steenburgen",Paul Flaherty,en,tt0109447,1556
142168,Searching for Debra Winger,2002,Documentary,"Patricia Arquette, Rosanna Arquette, Emmanuelle Béart",Rosanna Arquette,en,tt0318049,6788
40752,Walk Like a Man,1987,Comedy,"Christopher Lloyd, Cloris Leachman, Howie Mandel",Melvin Frank,en,tt0094288,3843
924,Dawn of the Dead,2004,"Fantasy, Horror, Action","Sarah Polley, Ving Rhames, Jake Weber",Zack Snyder,en,tt0363547,723
38,Eternal Sunshine of the Spotless Mind,2004,"Science Fiction, Drama, Romance","Jim Carrey, Kate Winslet, Kirsten Dunst",Michel Gondry,en,tt0338013,24
4377,The Child I Never Was,2002,"Drama, Crime, Foreign","Tobias Schenke, Ulrike Bliefert, Walter Gontermann",Kai S. Pieck,de,tt0355683,1924
1720,Noi the Albino,2003,Drama,"Tómas Lemarquis, Þröstur Leó Gunnarsson, Elín Hansdóttir",Dagur Kári,is,tt0351461,1056
5516,The Ladykillers,2004,"Comedy, Crime, Thriller","Tom Hanks, Irma P. Hall, Marlon Wayans",Joel Coen,en,tt0335245,2244
553,Dogville,2003,"Crime, Drama, Thriller","Nicole Kidman, Harriet Andersson, Lauren Bacall",Lars von Trier,da,tt0276919,415
1487,Hellboy,2004,"Fantasy, Action, Science Fiction","Ron Perlman, Selma Blair, Rupert Evans",Guillermo del Toro,en,tt0167190,913
2122,The Whole Ten Yards,2004,"Comedy, Thriller, Crime","Bruce Willis, Matthew Perry, Amanda Peet",Howard Deutch,en,tt0327247,1320
6844,The Ten Commandments,1956,"Drama, History","Charlton Heston, Yul Brynner, Anne Baxter",Cecil B. DeMille,en,tt0049833,2493
923,Dawn of the Dead,1978,Horror,"David Emge, Ken Foree, Scott H. Reiniger",George A. Romero,en,tt0077402,722
2587,"Brother Sun, Sister Moon",1972,"War, Drama, History","Graham Faulkner, Judi Bowker, Leigh Lawson",Franco Zeffirelli,it,tt0069824,1482
3591,One Million Years B.C.,1966,"Action, Adventure, Fantasy","Raquel Welch, John Richardson, Percy Herbert",Don Chaffey,en,tt0060782,1782
26176,"Mother, Jugs & Speed",1976,Comedy,"Bill Cosby, Raquel Welch, Harvey Keitel",Peter Yates,en,tt0074923,3038
68347,Food of the Gods II,1989,"Horror, Science Fiction","Paul Coufos, Lisa Schrage, Réal Andrews",Damian Lee,en,tt0097371,4679
4365,Munchies,1987,"Comedy, Horror, Science Fiction","Nadine Van der Velde, Charlie Stratton, Harvey Korman",Tina Hirsch,en,tt0093582,1920
2098,Viva Las Vegas,1964,"Comedy, Drama, Music, Romance","Elvis Presley, Ann-Margret, William Demarest",George Sidney,en,tt0058725,1301
393,Kill Bill: Vol. 2,2004,"Action, Crime, Thriller","Uma Thurman, David Carradine, Daryl Hannah",Quentin Tarantino,en,tt0378194,298
7220,The Punisher,2004,"Action, Crime, Drama","Thomas Jane, John Travolta, Will Patton",Jonathan Hensleigh,en,tt0330793,2551
33823,Paper Clips,2004,Documentary,No Actor,Elliot Berlin,en,tt0380615,3714
237,Young Adam,2003,"Drama, Thriller, Crime, Romance","Ewan McGregor, Tilda Swinton, Peter Mullan",David Mackenzie,en,tt0289635,183
7131,Van Helsing,2004,"Horror, Adventure, Action","Hugh Jackman, Kate Beckinsale, Richard Roxburgh",Stephen Sommers,en,tt0338526,2542
652,Troy,2004,"Adventure, Drama, War","Brad Pitt, Orlando Bloom, Eric Bana",Wolfgang Petersen,en,tt0332452,502
42015,Swimming to Cambodia,1987,"Comedy, Drama",Spalding Gray,Jonathan Demme,en,tt0094089,3886
57811,Foreign Land,1996,"Drama, Thriller, Romance, Foreign","Fernanda Torres, Fernando Alves Pinto, Laura Cardoso",Walter Salles,pt,tt0114651,4434
132,The Rolling Stones: Gimme Shelter,1970,"Documentary, Music","Mick Jagger, Keith Richards, Charlie Watts",Albert Maysles,en,tt0065780,89
4339,The Nasty Girl,1990,"Comedy, Drama, Foreign","Lena Stolze, Hans-Reinhard Müller, Monika Baumgartner",Michael Verhoeven,de,tt0100557,1914
5247,Mercy,2000,"Drama, Mystery, Thriller","Ellen Barkin, Wendy Crewson, Peta Wilson",Damian Harris,en,tt0188055,2199
502,Fail-Safe,1964,"Drama, History, Thriller","Henry Fonda, Walter Matthau, Fritz Weaver",Sidney Lumet,en,tt0058083,376
1373,The Discovery of Heaven,2001,"Drama, Fantasy","Stephen Fry, Greg Wise, Neil Newbon",Jeroen Krabbé,en,tt0251052,860
667,You Only Live Twice,1967,"Action, Thriller, Adventure","Sean Connery, Akiko Wakabayashi, Karin Dor",Lewis Gilbert,en,tt0062512,516
700,Octopussy,1983,"Adventure, Action, Thriller","Roger Moore, Maud Adams, Louis Jourdan",John Glen,en,tt0086034,543
26976,Wit,2001,"Drama, TV Movie","Emma Thompson, Christopher Lloyd, Eileen Atkins",Mike Nichols,en,tt0243664,3287
44864,The Magic Flute,1975,"Fantasy, Comedy, Music, Romance","Josef Köstlinger, Irma Urrila, Håkan Hagegård",Ingmar Bergman,sv,tt0073822,4016
633,Soldier of Orange,1977,"Drama, History, Thriller, War","Rutger Hauer, Jeroen Krabbé, Susan Penhaligon",Paul Verhoeven,nl,tt0076734,485
5511,Le Samouraï,1967,"Crime, Drama, Thriller","Alain Delon, François Périer, Nathalie Delon",Jean-Pierre Melville,fr,tt0062229,2243
294,Desert Hearts,1985,"Drama, Romance","Helen Shaver, Patricia Charbonneau, Audra Lindley",Donna Deitch,en,tt0089015,235
1162,The Miracle Worker,1962,Drama,"Anne Bancroft, Patty Duke, Victor Jory",Arthur Penn,en,tt0056241,808
26670,Noises Off...,1992,Comedy,"Carol Burnett, Michael Caine, Denholm Elliott",Peter Bogdanovich,en,tt0105017,3193
5842,Versus,2000,"Action, Horror","Tak Sakaguchi, Hideo Sakaki, Chieko Misaka",Ryûhei Kitamura,ja,tt0275773,2323
988,The China Syndrome,1979,"Thriller, Drama","Jane Fonda, Jack Lemmon, Michael Douglas",James Bridges,en,tt0078966,772
204,The Wages of Fear,1953,"Drama, Thriller, Adventure","Yves Montand, Charles Vanel, Peter van Eyck",Henri-Georges Clouzot,fr,tt0046268,155
27171,The Lonely Guy,1984,"Comedy, Romance","Steve Martin, Charles Grodin, Merv Griffin",Arthur Hiller,en,tt0087635,3316
27786,Steel Dawn,1987,"Action, Adventure, Science Fiction","Patrick Swayze, Lisa Niemi, Anthony Zerbe",Lance Hool,en,tt0094033,3436
25736,The Postman Always Rings Twice,1946,"Crime, Drama, Thriller","Lana Turner, John Garfield, Cecil Kellaway",Tay Garnett,en,tt0038854,2904
5248,Virtual Sexuality,1999,Comedy,"Laura Fraser, Rupert Penry-Jones, Luke de Lacey",Nick Hurran,en,tt0164221,2200
2786,Pierrot le Fou,1965,"Drama, Thriller","Jean-Paul Belmondo, Anna Karina, Graziella Galvani",Jean-Luc Godard,fr,tt0059592,1558
50271,Strange Cargo,1940,Drama,"Joan Crawford, Clark Gable, Ian Hunter",Frank Borzage,en,tt0033105,4223
26133,Tuesdays with Morrie,1999,Drama,"Jack Lemmon, Hank Azaria, Wendy Moniz",Mick Jackson,en,tt0207805,3018
2817,Same Old Song,1997,"Drama, Comedy, Romance","Pierre Arditi, Sabine Azéma, Agnès Jaoui",Alain Resnais,fr,tt0119828,1567
1394,Nostalgia,1983,"Drama, Romance","Oleg Yankovskiy, Erland Josephson, Domiziana Giordano",Andrei Tarkovsky,ru,tt0086022,875
1719,The Soft Skin,1964,"Drama, Romance","Françoise Dorléac, Jean Desailly, Nelly Benedetti",François Truffaut,fr,tt0058458,1055
781,Wintersleepers,1997,Drama,"Ulrich Matthes, Marie-Lou Sellem, Floriane Daniel",Tom Tykwer,de,tt0120522,594
3777,Throne of Blood,1957,"Drama, History","Toshirō Mifune, Isuzu Yamada, Akira Kubo",Akira Kurosawa,ja,tt0050613,1812
26612,Treasure Island,1990,"Adventure, Family","Charlton Heston, Christian Bale, Oliver Reed",Fraser Clarke Heston,en,tt0100813,3181
77780,Twister,1989,"Drama, Comedy","Harry Dean Stanton, Suzy Amis, Crispin Glover",Michael Almereyda,en,tt0096321,4936
1926,11'09''01 - September 11,2002,Drama,"Ernest Borgnine, Maryam Karimi, Emmanuelle Laborit",Alejandro González Iñárritu,en,tt0328802,1173
31112,"Bon Voyage, Charlie Brown (and Don't Come Back!)",1980,"Animation, Comedy, Family","Arrin Skelley, Laura Planting, Casey Carlson",Phil Roman,en,tt0080461,3500
4923,Zardoz,1974,"Fantasy, Action, Thriller, Science Fiction","Sean Connery, Charlotte Rampling, Sara Kestelman",John Boorman,en,tt0070948,2084
465,Junior Size 36,1988,"Romance, Drama","Delphine Zentout, Olivier Parnière, Jean-Pierre Léaud",Catherine Breillat,fr,tt0094596,350
876,Frank Herbert's Dune,2000,"Action, Adventure, Fantasy, Science Fiction","William Hurt, Alec Newman, Saskia Reeves",John Harrison,en,tt0142032,683
1583,Lammbock,2001,Comedy,"Lucas Gregorowicz, Moritz Bleibtreu, Marie Zielcke",Christian Zübert,de,tt0258760,959
57946,Margaret Cho: Notorious C.H.O.,2002,Comedy,Margaret Cho,Lorene Machado,en,tt0300274,4438
26860,White Zombie,1932,Horror,"Bela Lugosi, John Harron, Madge Bellamy",Victor Halperin,en,tt0023694,3259
31952,The Vampire Lovers,1970,Horror,"Ingrid Pitt, Peter Cushing, George Cole",Roy Ward Baker,en,tt0066518,3580
336,"Duck, You Sucker",1971,Western,"James Coburn, Rod Steiger, Romolo Valli",Sergio Leone,it,tt0067140,270
5927,Junior Bonner,1972,"Action, Drama, Western","Steve McQueen, Robert Preston, Ida Lupino",Sam Peckinpah,en,tt0068786,2356
3075,Frankenstein Must Be Destroyed,1969,"Horror, Science Fiction","Peter Cushing, Veronica Carlson, Freddie Jones",Terence Fisher,en,tt0065738,1665
5521,Finder's Fee,2001,"Drama, Thriller","Erik Palladino, Dash Mihok, Carly Pope",Jeff Probst,en,tt0192023,2246
27636,The Whip and the Body,1963,"Mystery, Horror","Daliah Lavi, Christopher Lee, Tony Kendall",Mario Bava,en,tt0057078,3406
222,Berlin: Symphony of a Great City,1927,"Documentary, History",Paul von Hindenburg,Walter Ruttmann,de,tt0017668,169
25858,Drunken Angel,1948,Drama,"Michiyo Kogure, Reisaburô Yamamoto, Toshirō Mifune",Akira Kurosawa,ja,tt0040979,2950
38701,The Devil's Rain,1975,Horror,"Ernest Borgnine, Eddie Albert, Ida Lupino",Robert Fuest,en,tt0072869,3802
1059,The Hidden Fortress,1958,"Adventure, Drama, Action, Comedy","Toshirō Mifune, Takashi Shimura, Minoru Chiaki",Akira Kurosawa,ja,tt0051808,790
26940,A Night in Casablanca,1946,Comedy,"Groucho Marx, Harpo Marx, Chico Marx",Archie Mayo,en,tt0038777,3273
26372,Shame,1968,"War, Drama","Liv Ullmann, Max von Sydow, Sigge Fürst",Ingmar Bergman,sv,tt0063611,3112
3547,Reflections in a Golden Eye,1967,"Thriller, Romance, Drama","Elizabeth Taylor, Marlon Brando, Brian Keith",John Huston,en,tt0062185,1764
107499,A Better Place,1997,Drama,"Eion Bailey, Robert DiPatri, Joseph Cassese",Vincent Pereira,en,tt0118705,5920
5481,Shock,1977,"Horror, Thriller","Daria Nicolodi, John Steiner, David Colin Jr.",Mario Bava,en,tt0075651,2231
5482,Rabid Dogs,1974,"Drama, Crime, Thriller","Riccardo Cucciolla, Don Backy, Lea Lander",Mario Bava,it,tt0071275,2232
5485,Baron Blood,1972,Horror,"Joseph Cotten, Elke Sommer, Massimo Girotti",Mario Bava,it,tt0069048,2235
7090,Ken Park,2002,Drama,"James Ransone, Tiffany Limos, Maeve Quinlan",Edward Lachman,en,tt0209077,2536
42632,Monterey Pop,1968,"Documentary, Music","Scott McKenzie, Denny Doherty, John Phillips",D.A. Pennebaker,en,tt0064689,3908
5902,A Bridge Too Far,1977,"Drama, History, War","Dirk Bogarde, James Caan, Michael Caine",Richard Attenborough,en,tt0075784,2344
4552,A Tale of Two Sisters,2003,"Drama, Horror, Mystery","Im Soo-jung, Yum Jung-ah, Moon Geun-Young",Kim Jee-woon,ko,tt0365376,1984
26326,Rock 'n' Roll High School,1979,"Comedy, Music","P.J. Soles, Vince Van Patten, Clint Howard",Allan Arkush,en,tt0079813,3093
27658,Cockfighter,1974,Drama,"Warren Oates, Richard B. Shull, Harry Dean Stanton",Monte Hellman,en,tt0071338,3410
42725,The Wild Angels,1966,"Action, Drama","Peter Fonda, Nancy Sinatra, Bruce Dern",Roger Corman,en,tt0061189,3918
4291,Kikujiro,1999,"Comedy, Drama, Family","Takeshi Kitano, Yusuke Sekiguchi, Kayoko Kishimoto",Takeshi Kitano,ja,tt0199683,1907
113,"Spring, Summer, Fall, Winter... and Spring",2003,Drama,"Kim Ki-duk, Kim Young-min, Ha Yeo-jin",Kim Ki-duk,ko,tt0374546,75
5916,The Getaway,1972,"Action, Crime, Thriller","Steve McQueen, Ali MacGraw, Ben Johnson",Sam Peckinpah,en,tt0068638,2347
3001,How to Steal a Million,1966,"Comedy, Crime, Romance","Audrey Hepburn, Peter O'Toole, Eli Wallach",William Wyler,en,tt0060522,1616
105130,Dangan Runner,1996,"Crime, Comedy, Action","Shinichi Tsutsumi, Tomorowo Taguchi, Diamond Yukai",SABU,ja,tt0116015,5831
166472,Manslaughter,1922,Drama,"Leatrice Joy, Thomas Meighan, Lois Wilson",Cecil B. DeMille,en,tt0013372,7279
62383,Passed Away,1992,Comedy,"Bob Hoskins, Blair Brown, Tim Curry",Charlie Peters,en,tt0105103,4560
203,Mean Streets,1973,"Drama, Crime","Harvey Keitel, Robert De Niro, David Proval",Martin Scorsese,en,tt0070379,154
26268,Harper,1966,"Action, Drama, Thriller, Crime, Mystery","Paul Newman, Lauren Bacall, Julie Harris",Jack Smight,en,tt0060490,3072
316,Grill Point,2002,"Comedy, Drama","Steffi Kühnert, Gabriela Maria Schmeide, Thorsten Merten",Andreas Dresen,de,tt0304126,254
3072,Frankenstein Unbound,1990,"Drama, Horror, Science Fiction","John Hurt, Raúl Juliá, Nick Brimble",Roger Corman,en,tt0099612,1662
250,In China They Eat Dogs,1999,"Action, Comedy, Crime","Dejan Čukić, Kim Bodnia, Brian Patterson",Lasse Spang Olsen,da,tt0180748,196
43267,29th Street,1991,Comedy,"Anthony LaPaglia, Danny Aiello, Lainie Kazan",George Gallo,en,tt0101252,3941
42013,Sammy and Rosie Get Laid,1987,"Drama, Comedy","Shashi Kapoor, Ayub Khan-Din, Frances Barber",Stephen Frears,en,tt0093913,3885
631,Sunrise: A Song of Two Humans,1927,"Drama, Romance","George O'Brien, Janet Gaynor, Margaret Livingston",F.W. Murnau,en,tt0018455,483
51182,Sex: The Annabel Chong Story,1999,Documentary,"Annabel Chong, Ron Jeremy, Jim South",Gough Lewis,en,tt0181810,4241
48385,Indestructible Man,1956,"Crime, Horror, Science Fiction","Lon Chaney Jr., Max Showalter, Marian Carr",Jack Pollexfen,en,tt0049363,4158
43011,Sodom and Gomorrah,1962,"Adventure, Drama, History","Stewart Granger, Stanley Baker, Pier Angeli",Robert Aldrich,en,tt0056504,3935
439,La Dolce Vita,1960,"Comedy, Drama","Marcello Mastroianni, Anita Ekberg, Anouk Aimée",Federico Fellini,it,tt0053779,334
823,Jin-Roh: The Wolf Brigade,1999,"Animation, Science Fiction, Thriller","Yoshikatsu Fujiki, Sumi Mutou, Hiroyuki Kinosha",Hiroyuki Okiura,ja,tt0193253,633
2546,Zazie dans le métro,1960,"Comedy, Fantasy","Catherine Demongeot, Philippe Noiret, Hubert Deschamps",Louis Malle,fr,tt0054494,1474
40478,Baby Doll,1956,Drama,"Karl Malden, Carroll Baker, Eli Wallach",Elia Kazan,en,tt0048973,3834
5165,L'Avventura,1960,"Drama, Mystery","Monica Vitti, Gabriele Ferzetti, Lea Massari",Michelangelo Antonioni,it,tt0053619,2177
5722,Beyond the Valley of the Dolls,1970,"Comedy, Drama, Thriller","Dolly Read, Cynthia Myers, Marcia McBroom",Russ Meyer,en,tt0065466,2291
5544,Hiroshima Mon Amour,1959,"Drama, History, Romance","Emmanuelle Riva, Eiji Okada, Stella Dassas",Alain Resnais,fr,tt0052893,2248
56167,The Golden Coach,1952,"History, Comedy, Drama","Anna Magnani, Odoardo Spadaro, Nada Fiorelli",Jean Renoir,it,tt0044487,4393
4781,The War Is Over,1966,"War, Drama","Yves Montand, Ingrid Thulin, Geneviève Bujold",Alain Resnais,fr,tt0060481,2042
4909,The Day of the Jackal,1973,"Action, Thriller","Edward Fox, Michael Lonsdale, Olga Georges-Picot",Fred Zinnemann,en,tt0069947,2074
73194,Drums Along the Mohawk,1939,"Romance, Drama, History, War, Western","Claudette Colbert, Henry Fonda, Edna May Oliver",John Ford,en,tt0031252,4843
27459,Little Murders,1971,Comedy,"Elliott Gould, Marcia Rodd, Vincent Gardenia",Alan Arkin,en,tt0067350,3381
4497,Viridiana,1961,Drama,"Silvia Pinal, Francisco Rabal, Fernando Rey",Luis Buñuel,es,tt0055601,1961
42728,You're a Big Boy Now,1966,"Comedy, Romance, Drama","Elizabeth Hartman, Geraldine Page, Rip Torn",Francis Ford Coppola,en,tt0061209,3919
5071,The Crazy Stranger,1997,"Drama, Music, Romance","Romain Duris, Rona Hartner, Izidor Serban",Tony Gatlif,fr,tt0122082,2159
4507,Jamon Jamon,1992,"Comedy, Drama, Romance","Javier Bardem, Penélope Cruz, Jordi Mollà",Bigas Luna,es,tt0104545,1964
4879,Ten Little Indians,1965,"Crime, Drama, Mystery, Thriller","Hugh O'Brian, Shirley Eaton, Fabian",George Pollock,en,tt0061075,2064
61048,The Swan,1956,"Comedy, Drama, History, Romance","Grace Kelly, Alec Guinness, Louis Jourdan",Charles Vidor,en,tt0049815,4538
1994,The Most Dangerous Game,1932,"Adventure, Horror, Thriller","Joel McCrea, Fay Wray, Leslie Banks",Ernest B. Schoedsack,en,tt0023238,1224
870,Dolls,2002,"Drama, Romance","Miho Kanno, Hidetoshi Nishijima, Tatsuya Mihashi",Takeshi Kitano,ja,tt0330229,677
96255,Three Came Home,1950,"War, Drama","Claudette Colbert, Patric Knowles, Florence Desmond",Jean Negulesco,en,tt0043041,5577
809,Shrek 2,2004,"Adventure, Animation, Comedy, Family, Fantasy","Mike Myers, Eddie Murphy, Cameron Diaz",Andrew Adamson,en,tt0298148,621
435,The Day After Tomorrow,2004,"Action, Adventure, Science Fiction, Thriller","Dennis Quaid, Jake Gyllenhaal, Emmy Rossum",Roland Emmerich,en,tt0319262,330
4599,Raising Helen,2004,"Drama, Comedy, Romance","Kate Hudson, John Corbett, Joan Cusack",Garry Marshall,en,tt0350028,2001
673,Harry Potter and the Prisoner of Azkaban,2004,"Adventure, Fantasy, Family","Daniel Radcliffe, Rupert Grint, Emma Watson",Alfonso Cuarón,en,tt0304141,521
246,Zatoichi,2003,"Adventure, Drama, Action","Takeshi Kitano, Tadanobu Asano, Michiyo Ohkusu",Takeshi Kitano,ja,tt0363226,192
2789,The Chronicles of Riddick,2004,"Action, Science Fiction","Vin Diesel, Thandie Newton, Karl Urban",David Twohy,en,tt0296572,1561
8920,Garfield,2004,"Animation, Comedy, Family","Bill Murray, Breckin Meyer, Jennifer Love Hewitt",Peter Hewitt,en,tt0356634,2839
26886,Bright Future,2003,"Drama, Mystery","Joe Odagiri, Tadanobu Asano, Tatsuya Fuji",Kiyoshi Kurosawa,ja,tt0363235,3264
26254,The Hunting of the President,2004,Documentary,"Morgan Freeman, James Carville, Paul Begala",Nickolas Perry,en,tt0391225,3064
26142,The Doctor,1991,Drama,"William Hurt, Christine Lahti, Elizabeth Perkins",Randa Haines,en,tt0101746,3023
46976,Wish You Were Here,1987,"Comedy, Drama, Foreign, Romance","Emily Lloyd, Tom Bell, Jesse Birdsall",David Leland,en,tt0094331,4088
831,This Island Earth,1955,"Mystery, Adventure, Science Fiction, Horror, Thriller","Jeff Morrow, Faith Domergue, Rex Reason",Joseph M. Newman,en,tt0047577,641
62000,Johnny Belinda,1948,Drama,"Jane Wyman, Lew Ayres, Charles Bickford",Jean Negulesco,en,tt0040495,4556
662,La Jetée,1962,"Romance, Science Fiction","Jean Négroni, Hélène Chatelain, Davos Hanich",Chris Marker,fr,tt0056119,511
8341,Samsara,2001,"Romance, Drama, Adventure","Shawn Ku, Christy Chung, Neelesha BaVora",Pan Nalin,en,tt0196069,2674
886,The Cincinnati Kid,1965,Drama,"Steve McQueen, Edward G. Robinson, Ann-Margret",Norman Jewison,en,tt0059037,691
26973,Pretty Baby,1978,"Drama, History","Brooke Shields, Keith Carradine, Susan Sarandon",Louis Malle,en,tt0078111,3285
26175,Ivanhoe,1952,"Action, Adventure, Drama, Romance","Robert Taylor, Elizabeth Taylor, Joan Fontaine",Richard Thorpe,en,tt0044760,3037
136,Freaks,1932,"Drama, Horror","Harry Earles, Daisy Earles, Olga Baclanova",Tod Browning,en,tt0022913,93
