movieId,title,year,genres,first_three_actors,director,original_language,imdb_id,movieIdInt
79043,The Story of Marie and Julien,2003,"Romance, Drama, Fantasy, Mystery","Emmanuelle Béart, Anne Brochet, Bettina Kee",Jacques Rivette,fr,tt0339357,4985
32196,"Dance, Girl, Dance",1940,"Music, Romance, Comedy","Maureen O'Hara, Lucille Ball, Louis Hayward",Dorothy Arzner,en,tt0032376,3612
95597,Black Girl,1966,Drama,"Toto Bissainthe, Ousmane Sembene, Robert Fontaine",Ousmane Sembene,fr,tt0060758,5559
105347,How Tasty Was My Little Frenchman,1971,"Comedy, Foreign, Adventure","Arduíno Colassanti, Ana Maria Magalhães, Eduardo Imbassahy Filho",Nelson Pereira dos Santos,pt,tt0066936,5840
98636,Kisses,1957,Drama,"Hiroshi Kawaguchi, Hitomi Nozoe, Saiko Mima",Yasuzô Masumura,ja,tt0050612,5665
96451,If God Is Willing and da Creek Don't Rise,2010,Documentary,No Actor,Spike Lee,en,tt1587373,5584
47670,The Christmas Toy,1986,"Animation, Family","Dave Goelz, Steve Whitmire, Kathryn Mullen",Eric Till,en,tt0099263,4122
172535,The Trials of Oscar Wilde,1960,"History, Drama","Peter Finch, Yvonne Mitchell, James Mason",Ken Hughes,en,tt0054403,7422
30846,Burrowing,2009,Drama,"Sebastian Eklund, Jörgen Svensson, Hannes Sandahl",Henrik Hellström,en,tt1381282,3474
139433,No One Dies in Lily Dale,2011,Documentary,No Actor,Steven Cantor,en,tt1609145,6716
103745,Vesku,2010,Documentary,Vesa-Matti Loiri,Mika Kaurismäki,fi,tt1539086,5790
39786,Visual Acoustics,2009,Documentary,"Dustin Hoffman, Tom Ford, Frances Anderton",Eric Bricker,en,tt1233611,3825
50641,The End of Poverty?,2008,Documentary,"Martin Sheen, John Christensen, John Perkins",Philippe Diaz,en,tt0903943,4231
44255,Off and Running,2009,Documentary,No Actor,Nicole Oppermann,en,tt1083853,3999
109881,Love Letters,1945,Romance,"Jennifer Jones, Joseph Cotten, Ann Richards",William Dieterle,en,tt0037885,5994
80806,Above and Beyond,1952,"Action, Drama","Robert Taylor, Eleanor Parker, James Whitmore",Melvin Frank,en,tt0044324,5066
133792,The Joker Is Wild,1957,Drama,"Frank Sinatra, Mitzi Gaynor, Jeanne Crain",Charles Vidor,en,tt0050569,6588
113214,"Oh, Susanna",1936,"Romance, Western","Gene Autry, Smiley Burnette, Frances Grant",Joseph Kane,en,tt0029334,6080
31549,Blood River,2009,"Horror, Thriller","Andrew Howard, Tess Panzer, Ian Duncan",Adam Mason,en,tt1137999,3542
148482,The Saimaa Gesture,1981,"Music, Documentary","Ismo Alanko, Reijo Heiskanen, Jussi Kinnunen",Aki Kaurismäki,fi,tt0083022,6918
55063,Still Bill,2010,"Documentary, Music","Bill Withers, Clarence Avant, Benorce Blackmon",Damani Baker,en,tt1333117,4358
4204,$5 a Day,2008,"Drama, Comedy","Christopher Walken, Alessandro Nivola, Sharon Stone",Nigel Cole,en,tt1024733,1874
32151,Triangle,2007,"Thriller, Action","Louis Koo, Simon Yam, Sun Honglei",Johnnie To,cn,tt0846017,3606
66701,Heroes for Sale,1933,Drama,"Richard Barthelmess, Aline MacMahon, Loretta Young",William A. Wellman,en,tt0024115,4651
8886,Palermo Shooting,2008,"Drama, Foreign","Dennis Hopper, Milla Jovovich, Giovanna Mezzogiorno",Wim Wenders,de,tt1008017,2819
148636,The Hunchback,1997,"Romance, Drama, Horror","Mandy Patinkin, Richard Harris, Salma Hayek",Peter Medak,en,tt0119329,6920
110748,History of Postwar Japan as Told by a Bar Hostess,1970,"Documentary, History","Rikiya Yasuoka, Fukumi Kuroda",Shôhei Imamura,ja,tt0066153,6024
107612,The Rocket from Calabuch,1956,Comedy,"Edmund Gwenn, Valentina Cortese, Juan Calvo",Luis García Berlanga,en,tt0049042,5923
50356,Susan Slept Here,1954,"Comedy, Drama","Dick Powell, Debbie Reynolds, Anne Francis",Frank Tashlin,en,tt0047550,4224
72913,Amigo,2010,"Drama, History, War","Chris Cooper, DJ Qualls, Garret Dillahunt",John Sayles,en,tt1562847,4833
94959,"Edward, My Son",1949,Drama,"Spencer Tracy, Deborah Kerr, Ian Hunter",George Cukor,en,tt0041329,5543
43923,It's Kind of a Funny Story,2010,"Comedy, Drama","Keir Gilchrist, Emma Roberts, Zach Galifianakis",Ryan Fleck,en,tt0804497,3983
5719,Mudhoney,1965,Drama,"Hal Hopper, Antoinette Cristiani, John Furlong",Russ Meyer,en,tt0059477,2289
71575,Entre Nos,2009,"Drama, Foreign","Paola Mendoza, Sebastian Villada, Laura Montana",Paola Mendoza,es,tt1212456,4775
2754,Abel,1986,"Comedy, Foreign","Alex van Warmerdam, Henri Garcin, Olga Zuiderhoek",Alex van Warmerdam,nl,tt0090579,1540
125946,The Last Letter,2002,Drama,Catherine Samie,Frederick Wiseman,en,tt0317341,6369
154442,Tree Without Leaves,1986,Drama,"Nobuko Otowa, Ichirô Zaitsu, Meiko Kaji",Kaneto Shindô,ja,tt0091823,7038
125948,Red Bear,2002,"Crime, Drama, Thriller","Julio Chávez, Soledad Villamil",Adrián Caetano,en,tt0318523,6370
75938,Twilight's Last Gleaming,1977,Thriller,"Burt Lancaster, Roscoe Lee Browne, Charles Durning",Robert Aldrich,en,tt0076845,4903
706,Effi Briest,1974,"History, Drama","Hanna Schygulla, Wolfgang Schenck, Ulli Lommel",Rainer Werner Fassbinder,de,tt0071458,549
41402,Let Me In,2010,"Drama, Horror, Mystery","Kodi Smit-McPhee, Chloë Grace Moretz, Richard Jenkins",Matt Reeves,en,tt1228987,3859
3592,One Million B.C.,1940,"Fantasy, Horror","Victor Mature, Carole Landis, Lon Chaney Jr.",Hal Roach,en,tt0032871,1783
70695,Dirty Girl,2010,"Drama, Comedy","Juno Temple, Jeremy Dozier, Milla Jovovich",Abe Sylvia,en,tt1107319,4734
27441,Countdown,1968,"Thriller, Science Fiction","James Caan, Joanna Moore, Robert Duvall",Robert Altman,en,tt0062827,3371
4706,The Lady Vanishes,1979,"Mystery, Thriller","Cybill Shepherd, Elliott Gould, Angela Lansbury",Anthony Page,en,tt0079428,2027
110790,"Murder, He Says",1945,Comedy,"Fred MacMurray, Helen Walker, Marjorie Main",George Marshall,en,tt0037931,6027
166671,The Long and Short of It,2003,"Short, Drama","Andrew Lesnie, Praphaphorn 'Fon' Chansantor, Paul Randall",Sean Astin,en,tt0343992,7284
75341,Budrus,2010,"Documentary, Foreign",No Actor,Julia Bacha,en,tt1542411,4895
8749,Hamlet Goes Business,1987,"Comedy, Drama","Pirkka-Pekka Petelius, Esko Salminen, Kati Outinen",Aki Kaurismäki,fi,tt0093139,2760
86233,The Other Side of the Mountain,1975,"Romance, Drama","Marilyn Hassett, Beau Bridges, Belinda Montgomery",Larry Peerce,en,tt0073496,5277
114333,The Hunt,1966,"Action, Drama","Ismael Merlo, Alfredo Mayo, José María Prada",Carlos Saura,es,tt0060223,6103
4921,Vivere,2007,"Drama, Foreign","Kim Schnitzer, Esther Zimmering, Hannelore Elsner",Angelina Maccarone,de,tt0497467,2082
165911,The Pear Tree,1998,"Romance, Drama","Golshifteh Farahani, Homayoun Ershadi, Mohammad Reza Shaban-Noori",Dariush Mehrjui,fa,tt0187809,7267
27372,There Was a Father,1942,Drama,"Chishu Ryu, Shûji Sano, Shin Saburi",Yasujirō Ozu,ja,tt0034591,3360
135198,12 Storeys,1997,"Comedy, Drama","Jack Neo, Boon Pin Koh, Yi Fong Chuang",Eric Khoo,en,tt0120116,6616
4729,The Gendarme Gets Married,1968,Comedy,"Louis de Funès, Geneviève Grad, Claude Gensac",Jean Girault,fr,tt0063005,2035
46979,Le amiche,1955,"Romance, Drama","Eleonora Rossi Drago, Gabriele Ferzetti, Franco Fabrizi",Michelangelo Antonioni,it,tt0047821,4089
6793,The Haunted Castle,1921,"Crime, Drama, Horror","Arnold Korff, Lulu Kyser-Korff, Lothar Mehnert",F.W. Murnau,en,tt0012651,2491
35957,Dial 1119,1950,"Thriller, Drama","Marshall Thompson, Virginia Field, Andrea King",Gerald Mayer,en,tt0042397,3752
1782,Afterwards,2008,"Drama, Thriller, Mystery","John Malkovich, Romain Duris, Evangeline Lilly",Gilles Bourdos,en,tt0940580,1080
44115,127 Hours,2010,"Adventure, Drama, Thriller","James Franco, Kate Mara, Amber Tamblyn",Danny Boyle,en,tt1542344,3993
52237,Quality Street,1937,"Comedy, Romance, Drama","Katharine Hepburn, Franchot Tone, Eric Blore",George Stevens,en,tt0029454,4270
43007,Period of Adjustment,1962,"Drama, Comedy","Anthony Franciosa, Jane Fonda, Jim Hutton",George Roy Hill,en,tt0056341,3933
49953,A Turtle's Tale: Sammy's Adventures,2010,"Animation, Family","Yuri Lowenthal, Gemma Arterton, Isabelle Fuhrman",Ben Stassen,en,tt1230204,4211
3007,Woman in the Moon,1929,"Drama, Comedy, Science Fiction, Romance","Willy Fritsch, Gerda Maurus, Klaus Pohl",Fritz Lang,de,tt0019901,1619
27563,Flamingo Road,1949,"Drama, Romance","Joan Crawford, Zachary Scott, Sydney Greenstreet",Michael Curtiz,en,tt0041373,3396
41058,I Shot Jesse James,1949,Western,"John Ireland, Reed Hadley, Tom Tyler",Samuel Fuller,en,tt0041497,3857
1673,Comanche Station,1960,"Action, Western","Randolph Scott, Nancy Gates, Claude Akins",Budd Boetticher,en,tt0053729,1026
49110,'R Xmas,2001,"Drama, Thriller","Drea de Matteo, Lillo Brancato, Ice-T",Abel Ferrara,en,tt0217978,4185
44571,The King of Fighters,2009,"Action, Thriller, Science Fiction","Sean Faris, Maggie Q, Ray Park",Gordon Chan,en,tt1038685,4004
112072,The magnetic man,2009,"Documentary, Music, Foreign","Atte Blom, Olavi Uusivirta, Emma Salokoski",Arto Halonen,fi,tt1533796,6051
157178,Grający z talerza,1995,"Drama, Fantasy, Romance","Mariusz Saniternik, Grażyna Błęcka-Kolska, Grzegorz Warchol",Jan Jakub Kolski,pl,tt0113205,7069
134569,The House,2011,"Animation, Family, Foreign","Kim Kkobbi, Ha Jae-Sook, Choi Jeong-ho",Joo-Young Ban,en,tt2408288,6607
92096,Vlad the Impaler: The True Life of Dracula,1979,"History, Drama","Stefan Sileanu, Ernest Maftei, Emanoil Petrut",Doru Nastase,ro,tt0141966,5466
87387,The Agony and Ecstasy of Phil Spector,2008,Documentary,"Phil Spector, Lana Clarkson, Ronnie Spector",Vikram Jayanti,en,tt1518821,5332
87415,From the Clouds to the Resistance,1979,Drama,"Olimpia Carlisi, Guido Lombardi, Gino Felici",Jean-Marie Straub,it,tt0079023,5335
93669,The Meetings of Anna,1978,Drama,"Aurore Clément, Helmut Griem, Magali Noël",Chantal Akerman,fr,tt0078152,5509
36373,M,1951,"Drama, Thriller","David Wayne, Howard Da Silva, Martin Gabel",Joseph Losey,en,tt0043766,3757
26769,Cocaine Cowboys II: Hustlin' with the Godmother,2008,"Action, Documentary",No Actor,Billy Corben,en,tt1176726,3232
120835,The Devil to Pay!,1930,"Comedy, Romance","Ronald Colman, Frederick Kerr, Loretta Young",George Fitzmaurice,en,tt0020821,6234
6320,Police,1985,"Romance, Drama, Thriller, Crime","Gérard Depardieu, Sophie Marceau, Richard Anconina",Maurice Pialat,fr,tt0089821,2424
36405,Reverse,2009,"Comedy, Drama, Thriller, Romance","Agata Buzek, Krystyna Janda, Marcin Dorociński",Borys Lankosz,en,tt1514837,3760
26663,The Man I Love,1947,Drama,"Ida Lupino, Robert Alda, Andrea King",Raoul Walsh,en,tt0038721,3192
80572,Intruder in the Dust,1949,Drama,"David Brian, Claude Jarman Jr., Juano Hernández",Clarence Brown,en,tt0041513,5049
130424,The Story of Three Loves,1953,Romance,"James Mason, Moira Shearer, Agnes Moorehead",Vincente Minnelli,en,tt0046374,6502
32234,Doppelganger,2003,"Comedy, Horror, Science Fiction, Thriller","Koji Yakusho, Hiromi Nagasaku, Yūsuke Santamaria",Kiyoshi Kurosawa,ja,tt0403990,3614
56693,Dillinger Is Dead,1969,"Drama, Foreign","Michel Piccoli, Anita Pallenberg, Gino Lavagetto",Marco Ferreri,it,tt0062893,4410
5562,Le Beau Serge,1958,Drama,"Edmond Beauchamp, Gérard Blain, Jean-Claude Brialy",Claude Chabrol,fr,tt0051404,2257
70800,The Outlaw and His Wife,1918,Drama,"Victor Sjöström, Edith Erastoff, John Ekman",Victor Sjöström,sv,tt0008879,4739
1906,Solo Sunny,1980,"Music, Drama","Renate Krößner, Fred Düren, Ursula Braun",Wolfgang Kohlhaase,de,tt0079924,1156
43919,Hatchet II,2010,"Horror, Comedy, Thriller","Danielle Harris, Kane Hodder, Parry Shen",Adam Green,en,tt1270835,3982
80701,The Master and Margaret,1972,"Drama, Fantasy, Romance","Ugo Tognazzi, Mimsy Farmer, Alain Cuny",Aleksandar Petrović,it,tt0068894,5058
48833,Night Catches Us,2010,"Drama, Romance","Anthony Mackie, Kerry Washington, Wendell Pierce",Tanya Hamilton,en,tt0775543,4174
150838,Hôtel des Invalides,1952,Documentary,Michel Simon,Georges Franju,en,tt0044733,6976
43930,"Tomorrow, When the War Began",2010,Action,"Caitlin Stasey, Rachel Hurd-Wood, Phoebe Tonkin",Stuart Beattie,en,tt1456941,3984
26138,Duelist,2005,Action,"Ha Ji-won, Kang Dong-won, Ahn Sung-Ki",Lee Myung-Se,ko,tt0475616,3020
8464,Top of the Food Chain,1999,"Horror, Comedy, Science Fiction","Campbell Scott, Fiona Loewi, Tom Everett Scott",John Paizs,en,tt0159797,2709
481,7 Virgins,2005,Drama,"Juan José Ballesta, Jesús Carroza, Antonio Dechent",Alberto Rodríguez,es,tt0461894,362
4266,The Breach,1970,Thriller,"Stéphane Audran, Jean-Pierre Cassel, Jean-Claude Drouot",Claude Chabrol,fr,tt0066318,1894
46788,Trash Humpers,2009,"Horror, Drama","Rachel Korine, Brian Kotzur, Travis Nicholson",Harmony Korine,en,tt1488163,4076
25908,The Valley of the Bees,1968,"Drama, History","Jan Kačer, Věra Galatíková, Zdeněk Kryzánek",František Vláčil,cs,tt0122770,2967
42984,The Insect Woman,1963,Drama,"Emiko Aizawa, Masumi Harukawa, Sachiko Hidari",Shôhei Imamura,ja,tt0057363,3931
31104,Pigs and Battleships,1961,"Crime, Drama, Action, Comedy","Hiroyuki Nagato, Jitsuko Yoshimura, Masao Mishima",Shôhei Imamura,ja,tt0054709,3499
107548,Chori Chori Chupke Chupke,2001,"Romance, Drama, Foreign","Salman Khan, Preity Zinta, Rani Mukerji",Mastan Alibhai Burmawalla,hi,tt0256692,5921
1361,The Return of the King,1980,"Animation, Family, Fantasy","Orson Bean, Theodore Bikel, William Conrad",Jules Bass,en,tt0079802,849
112674,The Cowboy and the Lady,1938,"Comedy, Romance","Gary Cooper, Merle Oberon, Patsy Kelly",H. C. Potter,en,tt0030018,6067
51357,The Scarecrow,1920,Comedy,"Buster Keaton, Joe Roberts, Sybil Seely",Buster Keaton,en,tt0011656,4249
80054,Primrose Path,1940,Drama,"Ginger Rogers, Joel McCrea, Marjorie Rambeau",Gregory La Cava,en,tt0032946,5026
161512,Mission to Moscow,1943,"War, Drama","Walter Huston, Ann Harding, Oskar Homolka",Michael Curtiz,en,tt0036166,7195
46207,White Material,2010,Drama,"Isabelle Huppert, Christopher Lambert, Nicolas Duvauchelle",Claire Denis,fr,tt1135952,4058
48127,The North Star,1943,"Action, Adventure, Drama","Dana Andrews, Anne Baxter, Erich von Stroheim",Lewis Milestone,en,tt0036217,4145
31694,Trouble in Mind,1985,"Crime, Drama, Thriller","Kris Kristofferson, Keith Carradine, Lori Singer",Alan Rudolph,en,tt0090209,3559
163659,Cochochi,2007,Family,"Antonio Lerma Batista, Evaristo Lerma Batista",Israel Cárdenas,en,tt0841017,7239
6474,Navajo Joe,1966,"Action, Western","Burt Reynolds, Aldo Sambrell, Nicoletta Machiavelli",Sergio Corbucci,it,tt0061587,2448
8995,C(r)ook,2004,"Comedy, Crime, Thriller","Moritz Bleibtreu, Henry Hübchen, Corinna Harfouch",Pepe Danquart,de,tt0407617,2887
7210,Hardcover,2008,Comedy,"Wotan Wilke Möhring, Justus von Dohnányi, Anna Dereszowska",Christian Zübert,de,tt1010313,2546
89126,Harlan: In the Shadow of Jew Süss,2009,"Documentary, Foreign",No Actor,Felix Moeller,de,tt1327726,5382
26277,Mujhse Dosti Karoge!,2002,"Drama, Comedy, Romance","Hrithik Roshan, Rani Mukerji, Kareena Kapoor",Kunal Kohli,hi,tt0272736,3076
25770,The Paleface,1922,"Western, Comedy","Buster Keaton, Virginia Fox, Joe Roberts",Buster Keaton,en,tt0012543,2925
51933,Handsome Harry,2009,"Crime, Drama","Jamey Sheridan, Steve Buscemi, Aidan Quinn",Bette Gordon,en,tt1318001,4262
108869,Toys in the Attic,1963,Drama,"Dean Martin, Geraldine Page, Yvette Mimieux",George Roy Hill,en,tt0057598,5960
2325,Leningrad,2009,"War, Drama","Gabriel Byrne, Mira Sorvino, Armin Mueller-Stahl",Aleksandr Buravsky,en,tt0432314,1423
162234,Lola and Billy the Kid,1999,Drama,"Gandi Mukli, Erdal Yildiz, Inge Keller",Kutlug Ataman,de,tt0137079,7205
122019,Macario,1960,"Drama, Fantasy, Mystery","Ignacio López Tarso, Pina Pellicer, Enrique Lucero",Roberto Gavaldón,es,tt0054042,6260
4798,"Je t'aime, je t'aime",1968,"Science Fiction, Drama","Claude Rich, Olga Georges-Picot, Anouk Ferjac",Alain Resnais,fr,tt0063152,2047
105448,The Letter,1999,Drama,"Chiara Mastroianni, Pedro Abrunhosa, Antoine Chappey",Manoel de Oliveira,fr,tt0158117,5844
1543,Emma's Bliss,2006,Drama,"Jördis Triebel, Jürgen Vogel, Hinnerk Schönemann",Sven Taddicken,de,tt0424992,929
8951,Don't Think About It,2007,"Family, Drama, Comedy","Valerio Mastandrea, Caterina Murino, Anita Caprioli",Gianni Zanasi,it,tt1093382,2858
88376,Visit to a Small Planet,1960,"Comedy, Science Fiction, Family","Jerry Lewis, Joan Blackman, Earl Holliman",Norman Taurog,en,tt0054446,5367
92399,The Story of Dr. Wassell,1944,"Drama, Action","Gary Cooper, Laraine Day, Signe Hasso",Cecil B. DeMille,en,tt0037316,5483
55061,Frankie & Alice,2010,"Drama, Thriller","Halle Berry, Stellan Skarsgård, Phylicia Rashād",Geoffrey Sax,en,tt1221208,4357
47610,Gravity,2010,"Crime, Drama","Jürgen Vogel, Fabian Hinrichs, Nora von Waldstätten",Maximilian Erlenwein,de,tt1442580,4118
1244,Eight Miles High,2007,"Music, Drama, Comedy","Natalia Avelon, Matthias Schweighöfer, David Scheller",Achim Bornhak,de,tt0764639,813
43936,S21: The Khmer Rouge Death Machine,2003,Documentary,"Chum Mey, Khieu 'Poev' Ches, Yeay Cheu",Rithy Panh,fr,tt0368954,3985
58937,Wittgenstein,1993,Drama,"Karl Johnson, Michael Gough, Tilda Swinton",Derek Jarman,en,tt0108583,4472
31903,History Is Made at Night,1937,"Romance, Drama","Charles Boyer, Jean Arthur, Leo Carrillo",Frank Borzage,en,tt0029002,3570
471,Bandyta,1997,Drama,"Til Schweiger, Polly Walker, Ida Jablonska",Maciej Dejczer,en,tt0129774,356
60213,Corto Maltese: The Ballad of the Salt Sea,2003,Animation,"Richard Berry, Patrick Bouchitey, Barbara Schulz",Richard Danto,it,tt1098199,4515
34767,The White Stripes: Under Great White Northern Lights,2009,"Documentary, Music","Jack White, Meg White",Emmett Malloy,en,tt1487275,3748
26530,Christmas Holiday,1944,"Drama, Crime","Deanna Durbin, Gene Kelly, Richard Whorf",Robert Siodmak,en,tt0036711,3152
113757,Up in Arms,1944,"Drama, Comedy, Music, Romance","Danny Kaye, Dinah Shore, Dana Andrews",Elliott Nugent,en,tt0037420,6090
47330,"Stewart Lee: If You Prefer a Milder Comedian, Please Ask for One",2010,Comedy,Stewart Lee,Tim Kirkby,en,tt1756754,4100
133119,Torch Song,1953,"Drama, Romance","Joan Crawford, Gig Young, Michael Wilding",Charles Walters,en,tt0046446,6566
122884,Of Human Hearts,1938,"Drama, Western","Walter Huston, James Stewart, Beulah Bondi",Clarence Brown,en,tt0030517,6278
139851,And Now My Love,1974,"Drama, Romance, Foreign","Marthe Keller, André Dussollier, Charles Denner",Claude Lelouch,fr,tt0072307,6729
71732,The Right of the Weakest,2006,"Crime, Drama, Thriller","Lucas Belvaux, Claude Semal, Patrick Descamps",Lucas Belvaux,fr,tt0454536,4785
72852,Hadewijch,2009,Drama,"Julie Sokolowski, Yassine Salime, Karl Sarafidis",Bruno Dumont,fr,tt1257562,4829
32122,The Devil's Playground,1976,Drama,"Arthur Dignam, Nick Tate, Simon Burke",Fred Schepisi,en,tt0074404,3601
126104,The Magic Gloves,2003,"Comedy, Drama","Vicentico, Valeria Bertuccelli, Fabián Arenillas",Martin Rejtman,es,tt0347131,6378
79731,Suraj Ka Satvan Ghoda,1993,"Drama, Romance","Rajit Kapoor, Siraj Ahmed, Rakesh Dhar",Shyam Benegal,hi,tt0108256,5013
120843,Girls About Town,1931,Comedy,"Kay Francis, Joel McCrea, Lilyan Tashman",George Cukor,en,tt0021910,6236
148432,Pekka ja Pätkä salapoliiseina,1957,Comedy,"Esa Pakarinen, Masa Niemi, Anja Hatakka",Armand Lohikoski,fi,tt0050832,6915
46441,Mirrors 2,2010,"Horror, Mystery, Thriller","Nick Stahl, William Katt, Emmanuelle Vaugier",Víctor García,en,tt1576699,4063
91419,All the Brothers Were Valiant,1953,Adventure,"Robert Taylor, Stewart Granger, Ann Blyth",Richard Thorpe,en,tt0045494,5443
109887,My Foolish Heart,1950,"Drama, Romance","Dana Andrews, Susan Hayward, Kent Smith",Mark Robson,en,tt0041672,5995
112705,The Luck of the Irish,1948,"Fantasy, Comedy, Romance","Tyrone Power, Anne Baxter, Cecil Kellaway",Henry Koster,en,tt0040553,6068
84296,Trader Horn,1931,"Action, Adventure","Harry Carey, Edwina Booth, Duncan Renaldo",W.S. Van Dyke,en,tt0022495,5195
43552,Vanishing on 7th Street,2010,"Mystery, Horror, Thriller","Hayden Christensen, Thandie Newton, John Leguizamo",Brad Anderson,en,tt1452628,3956
114246,Fantasma,2006,Drama,"Argentino Vargas, Misael Saavedra",Lisandro Alonso,en,tt0809427,6102
140527,Glitterbug,1994,"Music, TV Movie, Documentary","William S. Burroughs, Derek Jarman, Tilda Swinton",Derek Jarman,en,tt0109909,6754
32520,Eight Diagram Pole Fighter,1984,"Action, Drama, Foreign","Gordon Liu Chia-Hui, Kara Hui, Alexander Fu Sheng",Liu Chia-Liang,zh,tt0086606,3633
36883,Midnight Movies: From the Margin to the Mainstream,2006,Documentary,"John Waters, Ben Barenholtz, Alejandro Jodorowsky",Stuart Samuels,en,tt0457414,3772
98078,Judith of Bethulia,1914,"Drama, History","Blanche Sweet, Henry B. Walthall, Mae Marsh",D.W. Griffith,en,tt0004181,5637
4704,At Long Last Love,1975,"Comedy, Music, Romance","Cybill Shepherd, Burt Reynolds, Duilio Del Prete",Peter Bogdanovich,en,tt0072665,2025
878,The Punch Bowl,1944,Comedy,"Heinz Rühmann, Karin Himboldt, Hilde Sessak",Helmut Weiss,de,tt0036818,685
37380,Thunder Bay,1953,"Adventure, Drama","James Stewart, Joanne Dru, Gilbert Roland",Anthony Mann,en,tt0046425,3779
131836,The Long Absence,1961,"Drama, Mystery","Alida Valli, Georges Wilson, Charles Blavette",Henri Colpi,en,tt0054426,6533
58376,Presumed Guilty,2008,"Documentary, Foreign",No Actor,Roberto Hernández,en,tt1320254,4455
49494,The Eagle,2011,"Adventure, Drama","Channing Tatum, Mark Strong, Jamie Bell",Kevin Macdonald,en,tt1034389,4198
44943,Battle: Los Angeles,2011,"Action, Science Fiction","Aaron Eckhart, Ramón Rodríguez, Will Rothhaar",Jonathan Liebesman,en,tt1217613,4020
34214,Crude,2009,Documentary,"Rafael Correa, Hugo Chávez, Trudie Styler",Joe Berlinger,en,tt1326204,3731
8770,Uncounted,2008,Documentary,No Actor,David Earnhardt,en,tt1279117,2767
31162,Black Lightning,2009,Action,"Grigoriy Dobrygin, Valeriy Zolotukhin, Ekaterina Vilkova",Dmitriy Kiselev,ru,tt1569364,3508
99329,The Money Order,1968,"Comedy, Foreign","Makhouredia Gueye, Isseu Niang, Mustapha Ture",Ousmane Sembene,wo,tt0063268,5672
71110,In The City,2003,"Drama, Romance, Foreign","Mónica López, Eduard Fernández, María Pujalte",Cesc Gay,es,tt0345185,4752
47931,Elite Squad: The Enemy Within,2010,"Drama, Action, Crime","Wagner Moura, Irandhir Santos, André Ramiro",José Padilha,pt,tt1555149,4138
70591,For Love of Ivy,1968,"Comedy, Drama, Romance","Sidney Poitier, Abbey Lincoln, Beau Bridges",Daniel Mann,en,tt0062985,4729
44657,Chang: A Drama of the Wilderness,1927,"Adventure, Drama, Documentary","Natives of the Wild, Wild Beasts, The Jungle",Merian C. Cooper,en,tt0017743,4007
103751,Täällä Pohjantähden alla II,2010,"Drama, War","Ilkka Koivula, Vera Kiiskinen, Risto Tuorila",Timo Koivusalo,fi,tt1433826,5792
81751,Casanova Brown,1944,Comedy,"Gary Cooper, Teresa Wright, Frank Morgan",Sam Wood,en,tt0036699,5099
2010,The Mourning Forest,2007,Drama,"Machiko Ono, Shigeki Uda, Makiko Watanabe",Naomi Kawase,ja,tt1016205,1240
99351,The Green Years,1946,Drama,"Charles Coburn, Tom Drake, Hume Cronyn",Victor Saville,en,tt0038578,5675
54354,Eila,2003,Drama,"Sari Mällinen, Ilkka Koivula, Hannes Suominen",Jarmo Lampela,fi,tt0343624,4339
8896,Delta,2008,Drama,"Orsolya Tóth, Félix Lajkó, Lili Monori",Kornél Mundruczó,hu,tt0910860,2824
3397,And Along Come Tourists,2007,Drama,"Alexander Fehling, Ryszard Ronczewski, Barbara Wysocka",Robert Thalheim,de,tt0775417,1730
48596,Ana and the Others,2003,"Drama, Foreign","Camila Toker, Ignacio Uslenghi, Juan Cruz Díaz la Barba",Celina Murga,en,tt0318988,4167
31408,Hababam Sınıfı Uyanıyor,1976,Comedy,"Münir Özkul, Adile Naşit, Kemal Sunal",Ertem Eğilmez,tr,tt0252490,3531
54001,The Traveler,1974,Drama,"Hassan Darabi, Masud Zandbegleh, Mostafa Tari",Abbas Kiarostami,fa,tt0071859,4320
86750,Warrendale,1967,Documentary,Martin Fischer,Allan King,en,tt0062474,5303
46105,American: The Bill Hicks Story,2010,"Comedy, Documentary","Kevin Booth, John Farneti, Bill Hicks",Matt Harlock,en,tt1179947,4057
57695,The Princess of Montpensier,2010,"Action, Drama, History, Romance","Mélanie Thierry, Lambert Wilson, Gaspard Ulliel",Bertrand Tavernier,fr,tt1599975,4429
101226,Dear Heart,1964,"Comedy, Family","Geraldine Page, Glenn Ford, Angela Lansbury",Delbert Mann,en,tt0057999,5717
3081,The Goddess,1958,Drama,"Kim Stanley, Lloyd Bridges, Patty Duke",John Cromwell,en,tt0051667,1671
76714,The Journey,1959,"Drama, Romance","Deborah Kerr, Yul Brynner, Jason Robards",Anatole Litvak,en,tt0052950,4915
31555,Pushover,1954,"Drama, Thriller, Crime","Fred MacMurray, Philip Carey, Kim Novak",Richard Quine,en,tt0047377,3543
26880,Children of Nature,1991,"Romance, Drama","Gísli Halldórsson, Sigríður Hagalín, Baldvin Halldórsson",Friðrik Þór Friðriksson,en,tt0101526,3263
47904,Outside the Law,2010,"Action, Drama, History, War","Jamel Debbouze, Roschdy Zem, Sami Bouajila",Rachid Bouchareb,fr,tt1229381,4136
53741,Crazy Love,1987,"Comedy, Drama, Foreign, Romance","Geert Hunaerts, Josse De Pauw, Michael Pas",Dominique Deruddere,en,tt0092794,4308
76816,The Age of the Earth,1980,Drama,"Antônio Pitanga, Tarcísio Meira, Jece Valadão",Glauber Rocha,pt,tt0080910,4919
51520,Blind Mountain,2007,Drama,Huang Lu,Li Yang,zh,tt1020972,4252
8904,Service,2008,Drama,"Coco Martin, Jaclyn Jose, Gina Pareño",Brillante Mendoza,tl,tt1225296,2830
167966,Voices from the List,2004,Documentary,Steven Spielberg,Michael Mayhew,en,tt0405455,7315
4880,Nichts als Gespenster,2006,"Comedy, Drama","Maria Simon, August Diehl, Stipe Erceg",Martin Gypkens,de,tt0803047,2065
48414,Alamar,2009,"Documentary, Drama, Family","Jorge Machado, Roberta Palombini, Natan Machado Palombini",Pedro González-Rubio,en,tt1502396,4161
125874,Love & Savagery,2009,"Romance, Drama","Allan Hawco, Sarah Greene, Louise Nicol",John N. Smith,en,tt1213921,6366
3581,Death Line,1972,Horror,"Donald Pleasence, Norman Rossington, David Ladd",Gary Sherman,en,tt0068458,1778
33134,The Horseman,2008,"Thriller, Crime","Caroline Marohasy, Brad McMurray, Peter Marshall",Steven Kastrissios,en,tt1060255,3672
106515,Ali Baba Goes To Town,1937,"Comedy, Family, Fantasy","Eddie Cantor, Tony Martin, Roland Young",David Butler,en,tt0028566,5890
44555,"A Woman, a Gun and a Noodle Shop",2009,"Comedy, Drama, Thriller","Sun Honglei, Xiao Shen Yang, Yan Ni",Zhang Yimou,zh,tt1428556,4003
